,아이디,댓글 내용,댓글 시간
388,  journey,도전그냥 될때까지 일주일이건 일년이건 계속 할거니까혹시 제가 안오면 댓글이나 좋아요로 불러주세요+우와 땅끄부부님이 좋아요 눌러주셨다 수정하면 없어져서 맘아푸ㅜ댓글은 처음인데 같이 운동하는 느낌이라힘도나고 열정도 생기는것같아요 앞으로 꾸준히 열심히 해서 좋은 후기 남길게요8/3 ️8/4 ️8/5️8/6,1년 전(수정됨)
389,  민댕이TV,너무 신나고 너무 시원했어요~내일저녁에 가족분들과 함께 할 예정입니다^^구독/,4개월 전
390,  Nature Kim,"거북목 때문에 등이 너무 아팠는데, 이거 하고나니까 훨씬 좋아졌어요bbbb",4개월 전
391,  전윤지,승모근이 울퉁불퉁하고 심해서 스트레스였는데 시간 날 때마다 속는셈 치고 따라한 지 거의 삼주 다 되가는데 눈에띄게 울퉁불퉁 하던 승모근이 일자로 펴졌어요 ㅜㅡㅜ 진짜 감사합니다........녀러분 속는 셈 치고 꼭 따라해보세요....!!!!!!! 진짜 이런 댓글 잘 안 다는데 달아봐요....,2년 전
392,  탱구리,3주 후기와 저 칼소폭이랑 해서여기에 댓글안달고 칼소폭에 체크했는데3주간 일주일에 5번정도 했어요.2주차부터 눈에 보이는 어깨가ㅋㅋ̤̫ㅋ̤̮저 허리도 많이 굽고 복부비만인데거북목이 진짜 심해서 칼소폭하자마자승모근을 필수로 했어요.솔직히 땀나는 운동도 아니고 스트레칭이라 한달만에 좋아지리라 생각도 안했는데 저희 가족이 어깨가 많이 펴졌다고 앞으로 자주자주 하라고 하더라구요!사람이 기운없어보이고 더 둔해보였는데어깨가 내려가니까 살빠진것같다고..감사합니다. 의료기술보다 더 좋은 땅끄,1년 전
393,  shn kim,보통 이거 할 때 몇분정도 해야하나요??,1년 전
394,  김범진,원래 없었는데 헬스(웨이트 운동)으로 인한 승모근도 없어질 수 있나요?,6개월 전
395,  라희,매일매일 저녁 마다 올께요 !!여름엔 예쁜 옷 입어야죠오..6/12 ,1년 전
396,  kong콩,제가 진짜 귀찮아서 원래 댓글 안달거든요?근데 이 영상은 그냥 대박입니다…..일단 제가 귀찮음이 정말 심해서 원래 잘 안하는데 개학을 앞두고 일주일 째 하고 있는데 와 그냥 대박이에요직각어깨가 되어가고있엉ㅅ 미치누ㅜㅜㅜㅜㅜ진짜 저 감격스러워서 죽겠어요 쇄골도 보이고 이런 적 처음이에요 너무 감사합니다 정말 제 전재산 다 드리고 싶네요 사랑합니다️️️️,1년 전
397,  호롤로,어느날 승모근을 보니 화산이 되어있어서 약 3일?정도 했는데 정말 많이 들어갔어요!히힣 앞으로도 계속 할거에욧!!!!ㅎㅎ,2년 전
398,  Rheld Alcls,5/4에서 8일까지 출석 안했는데생각날때마다 틈틈히 자극 줌근데 오른쪽승모근 자극이심하고 왼쪽은잘 안오길래 뭔가 했는데 최근에 거울보니까오른쪽승모근이 없어지진않았지만 라인이정리된것같고 왼쪽은 조금 튀어나와있음 효과는 있는거같다...!꾸준히해야지4/28 출석4/29 출석4/30 출석5/2 출석5/3 출석5/9출석5/10출석,1년 전(수정됨)
399,  나희원,자주할수로 좋아지나요? 아니면 하루에 몇번이 좋나요?,1년 전
400,  비둡두,이 운동 하고 효과가 장기적으로도 유지가 되나요?,2개월 전(수정됨)
401,  초록,"안녕하세요 땅끄부부님! 항상 잘 보고 있는데요, 질문이 있어서 여쭤봐요! 이 스트레칭 하고 나서 손으로 안마하듯이 승모근 주무르거나 손가락으로 꾹꾹 눌러도 되나요? 혹시 그렇게 하면 더 두꺼워질까요??",1년 전(수정됨)
402,  Jy yee,요즘 너무 어깨랑 목이 아파서 운동 열심히 할려고 댓글 남깁니다~ 매일매일 자기 전 한번씩은 꼭 하고 시간 될때는 아침에도 하려고 해용12/18 12/1912/2012/2112/2212/2312/2312/2412/2512/2612/2712/2812/2912/3012/31,11개월 전(수정됨)
403,  수연김,개학하기 전까지 하루에 4세트씩 운동하기 1/17-18-19-20-21-22-23-24-25-26-27-28-29-30-31-2/1-2-3-4-5-6-7-8-9-10-11-12-13-14-15-16-17-18-19-20-21-22-23-24-25-26-27-28-29-끗!!,2년 전
404,  중딩중딩,이거 아침에 한번 저녁에 자기전에 한번 이렇게 일주일 밖에 안 했는데 효과 본 1인 입니다,1년 전
405,  미현,어깨가 너무 아파서 어떻게 해야 되지 할까 하다가 땅끄부부생각나서 해봤는데 확실히 너무 시원하네요 앞으로도 자주 해야겠어요 감사합니다,1개월 전
406,  날치,한 달 동안 꾸준히 하기!!10/10  10/11 10/12 10/13 10/14 10/15 ,1년 전(수정됨)
407,  이혜리,이거 일주일정도 했는데 쇄골이 U자였는데 진짜 거의 일자가 됐어요!! 사람들도 알아보구용!! 근데 그동안 u자형태라 잘 몰랐는데 왼쪽 쇄골이 오른쪽 보다 높게 있네요ㅠㅠ 이런 경우 체형교정 영상도 있을까요???,1년 전
408,  박아영,시원해요오오~~~~,1년 전
409,  강지은,승모근 운동 3일차 후기화난 승모근이 내려감.화난 쇄골이 일자 쇄골로 변함 (2% 아직 부족하긴 함). 유후~~~ 감사합니다~~~,2년 전
410,  찐찐,승모근때문에 어깨가 시옷자 였던 사람입니다일주일 하니 반이 들어갔어요 감삼다..감삼다..,1년 전
411,  윤성희,최근에  땅끝부부  알게되서  넘  행복합니다.,1년 전(수정됨)
412,  조이,뱃살운동후 좋아요시원해요감사뱃살도 잘하고있어요 감사,1년 전
413,  이연지,아침 저녁으로 한번씩 오늘부터 시작 할게요! 여름에 오프솔더 입고 싶다악ㅜ4/4 ️ ️4/5 ️ ️4/6 ️4/74/8,1년 전(수정됨)
414,  하깽,요즘 어깨가 너무 뭉쳐서 잘 때 팔 올리고 자는게 습관이 됐어요.. 이대론 안되겠다 싶어서 이 영상 찾아서 따라하는데 어깨 뒤로 돌리는 순간 우드득 소리가..ㅎ 꾸준히 해서 어깨통증 좀 줄여봐야겠어요..ㅠㅠ,8개월 전
415,  김은빈, 다시 시작하는 승모근 없애기DAY-1: 200405 ️DAY-2: 200406 ️DAY-3: 200407 ️DAY-4: 200408 ️DAY-5: 200409 ️DAY-6: 200410 ️DAY-7: 200411 ️DAY-8: 200412 ️DAY-9: 200413 ️DAY-10: 200414 ️DAY-11: 200415 ️DAY-12: 200416 ️DAY-13: 200417 ️DAY-14: 200418 ️DAY-15: 200419 ️DAY-16: 200420 ️DAY-17: 200421 ️   200422200423 DAY-18: 200424 ️,2년 전(수정됨)
416,  자두,땅끄부부님!! 이영상을 하루에 한번씩 보면서 따라하면되는건가요? 아니면 2번봐야되나요 동작할때 팔에 힘이 들어가서 힘들고 다하고나면 시원한느낌도 아무느낌이없는데 이렇게하는거맞나요? ㅠㅠ,9개월 전(수정됨)
417,  rose of sharon,땅끄부부님 다른 승모근운동과 병행하겠습니다!!2/23 2/24 2/25 2/26 2/27 2/28 3/1.  3/2.  3/3.  3/4.  3/5.  3/6.  3/7.  3/8.  3/16 3/17 3/22 3/24 3/29 3/30 3/31 ,1년 전(수정됨)
418,  귤귤,공시생인데 목 너무아프고 승모근 솟고 두통있는데 오늘부터 매일해야겠습니다^^,8개월 전
419,  oo,어쩔 수 없이 푸시 백풀할때 팔을 들고있다보니 어깨에 힘이 들어가서 좀 땡기는데 괜찮은 건가요??,7개월 전
420,  혜원,1일차 후기 너무너무 개운해요 또 찾아올께용 사랑해요 땅끄부부️️,3주 전
421,  쿠키,이 컨텐츠 너무 좋아요ㅠㅠ 감사합니다!!!재능기부짱짱맨걸♡♡♡,4년 전
422,  yena,"안녕하세요! 땅끄 부부님!! 제가 이 운동을 한지 2주 정도 되었는데요, 원래 승모근이 많았던 터라 잘 안 빠진다고 생각을 했습니다  근데 생각 보다 승모근이 안 앖어지더라구요 ㅠㅠ 제가 목이 짧고 어깨가 산 모양이라 ㅠ 얼만큼 해야 승모근이 빨리 없어질까요?ㅜ 옷 만 입으면 승모근 때문에 뚱뚱해 보여요 ㅠ 혹시나 좋은 습관이나 방법이 있다면 사람 한명 살리신다고 생각하고 저 좀 도와주세요!!ㅠ 학교 다녀올 테니 답글 부탁 드립니다 ㅠ 좋은 하루되세요",1년 전
423,  삼다수,땅끄부부님! 운동하다가 궁금한게 있어서 댓글남깁니다! 제가 매일 자기전에 팔굽혀펴기 10~15개씩 하고 있는데 혹시 팔굽혀펴기를 하면 승모근이 생기나요??,1년 전
424,  지혜,승모근 없는 예쁜 직각 어깨 만들고 싶어요 퓨ㅜㅜㅜㅠ잊어버리지 않게 지나가다가 한 번씩 눌러주시면 감사하겠습니다..!!7/26-7/27-(와.. 하다가 뚝 소리났어욬)7/28-7/29-7/30-7/31-8/1-8/2-8/3-8/4-8/5-8/6-8/7-8/8-,1년 전(수정됨)
425,  whydontwe,"이 운동 3개월 넘게 한 사람인데 승모근 많이 없어져요 효과 좋음 근데 단점은 1달 쉬면 승모근 또 올라오는 느낌임,, 꾸준하게 해주면 효과 봐요",3개월 전
426,  스프,꾸준히 하면 라운드숄더 많이 나아지겠죠?ㅜㅜ,11개월 전(수정됨)
427,  흔한 아로하,저 이거 일주일동안 꾸준히 한번씩 자기 전에 따라했는데 승모근 부자에서 일자어깨 한 98% 정도 됐어요 아마 단기간 젤 효과 본 동영상일 거에요 ㅠㅠㅠ징짜 너무 쉽고 간단한데 신경써서 지그시~ 해주시면 정말 후회안하실 거에요 ㅠㅠㅠㅠㅠㅠㅠ 땅끄부부님 들숨에 건강을 날숨에 재력 얻으시길 바랄게요 ㅠㅠㅠㅠㅠㅠ️,3년 전
428,  아이시떼루,스쿼트 복근운동 이제 이 영상이다 1오늘 함 와 이건 너무 자주해서 그냥 거울볼때마다 운동이 쉬워서 외우고 했거든요? ㅋㅋㅋㅋㅋ미쳤어요 진짜근데 제가 오른손잡이여서 승모근을 좀 주물러 주면서 하면 더 좀 좋다고 해서 그냥 맨날 주물렀는데 ㅋㅋㅋㅋ왼쪽은 진짜 뭉치는 느낌없이 말랑해서 늘어날 정도로 들어갔는데 오른쪽은 왼손에 힘이 없고 왼손을 사용할 일이 없어서 대충 주물렀거든요 ㅋㅋㅋ어떡해요ㅠㅠ 저 승모근 짝짝이 됬어요ㅠㅠㅠ왼쪽은 잘 주물러줘서 들어갔는데 오른쪽만 뽈록해요 ㅠㅠ,1년 전(수정됨)
429,  재인,2:34 너무 시원해요!!!!!!!!!,7개월 전
430,  시은,"내가 제일 많이 보는 땅끄부부 운동영상 중 하나,,, 쉽다..ㅎㅎ",1년 전
431,  생각대로,좋아요! 사무실에서도 할수 있는 유익한 스트레칭!승모은~~읎다!,1년 전
432,  봉다리,한세트하고나니 어깨가 한결편해지네요,9개월 전
433,  쑥봉이,동작은 간단한데 너무 시원해요  승모근 사라지겠지요~~12/1  완료12/3  완료12/10  완료,1년 전(수정됨)
434,  노랑,두분 다 넘 귀여우셔 ㅋㅋㅋㅋㅋㅋㅋㅋ 그래서 자꾸 땅끄부부님 운동 따라하게 되나봄,1년 전
435,  수염이,2일차 입니다 힘을빼고 돌리라는데 마지막엔 너무 시원해서 격해지더라구요 승모근이 더 솓아오르는건 아닐지 내일 다시와야겠어요,10개월 전
436,  호두마루,넥숄더 릴리프할때마다 드드둑 드둑  계속어리는데 괜찮은건가요?? 날개뻐 어깨뒷쪽이요,11개월 전
437,  구르믱,한달동안 매일 와보기 도전이요!2월 21일:️2월 22일:까먹고 안 했다..ㅠ2월 23일:️,1년 전(수정됨)
438,  예은,파이팅8/23 했어요!!8/24 했지용,1년 전(수정됨)
439,  이영주,운동만하고나면 어깨가 아파서 꼭해주는 운동인데 도움이많이되네요! 두분넘귀여우세요 양말도 맞춰신으시고ㅎㅎ 승모근없다~ 넘재밌음ㅎ,2년 전
440,  김예은,오늘부터 시작 이쁜 어깨 만들기!!!7/30 7/31 8/1 8/2 8/3 8/4 8/5 8/68/78/88/9,1년 전(수정됨)
441,  뭐해,방학 한지 일주일은됐지만 이재브터라고 옷 핏좀 잘 받게 하겠습미다 진짜 시간날때 힐게요 개학할때까지7.22~8.16(방학기간)중에 두번 안함※개학이라 저녁에 한번씩만8.178.188.198.208.218.228.238.248.25(와 정말 좋아짐)8.26,1년 전(수정됨)
442,  오엥,버섯증후군에도 효과가 있을까요??ㅠㅠ,1년 전
443,  도라지,넘 시원하다..,7개월 전
444,  자콩이,10/13 10/14 10/15 10/1610/17 10/1810/19 이야 확실히 승모근 한 층이 사라짐 10/27 10/29 11/21 ,1년 전(수정됨)
445,  며나,땅끄님!!골반 넓어질수 있는 운동도 올려주세용️제가 골반이 너무 없어서 치마나 바지 입으면 태가 별로 안살드라구여ㅠㅠ그래서 다른사람들이 올린 골반 넓어지는 운동을 따라해봤는데 크게 효과는 못본거 같아요ㅜ땅끄님이 올려주신 영상은 제가 잘따라하고 쉬워서 잘 실천 할수있게되용️올려주시면 너무너무너무 감사하겠습니당ㅎㅎ,4년 전
446,  려울,2주 정도 했는데 승모근이 더 발달한 거 같아요…,3개월 전
447,  djwjfxlql,거북목 교정에도 효과 있나요??,1년 전
448,  구르미,열분... 저 중딩이고 오늘부터 부지런히 시작합니댜 효과 제 두 눈으로 봐야할것 같슴다 중간고사 끝나고 4월말에 돌아올게료.. 후기 진짜 꼭! 올리겠슴당 기다리세욥ㅂ,8개월 전
449,  아서,2주동안 해봤는데요 항상 제가 잠을 잘못자거나 목을 꺾고 자서 뒷목이랑 어깨가 많이 아팠는데 이거하고 나서 잘못 자도 아픈게 없고 거북목교정은 된지 안된지 잘 모르겠지만 확실히 안했을때랑 했을때의 뭉침이 차이가 많이커요 직각어깨는 개인적으로 다이어트를 하고 있어서 그런가 원래 어깨모양이 직각이였는지 잘 모르겠어서 말해드리기 어렵네요 ㅠㅠ 앞으로도 꾸준히 해볼 생각입니당!,1년 전
450,  박규빈,이 운동 많이 하면 어깨가 넓어지나여???,11개월 전
451,  갈빈,이거진짜 말도 못할정도로 아팠어요ㅠㅠ 그정도로 승모근이 많아요..ㅠ 오늘이 1일 차에요!! 처음으로 일지 남겨용,3년 전
452,  이샹해씨,일주일 뒤에 와볼께욤~ 감사합니다,7개월 전
453,  십존잘콜렉터,다음주 금요일 소풍이라서 시작한 승모근 없애기 4.30 - O5.01 - O,1년 전(수정됨)
454,  Malon jo,승모근이 풀리면 통증도 줄어드나요?,1년 전
455,  제똥이,와 이거 미쳣음... 요새 어깨 많이 썼더니 승모근 생겨서 반신반의 하면서 이틀했는데 직각 어깨 비슷하게 됏음 ㅣㅜ 눈물날라함레전드네이거;,5개월 전
456,  비비B,땅끄님들 오랜만에 왔어요~ 오늘도 땀 흠뻑흘리고 갑니다!,1년 전
457,  머슬몽키,따라하고 나니 정말 쉬원하네요  이런스트레칭은 잘몰랐는데 운동할때 포함시켜야겠네요 감사합니다 땅끄부부 보기좋네요 부러워요 ㅋ,3년 전
458,  이수연,딱 꾸준히 1달 도전6/23 ☆6/246/256/266/27★6/286/296/307/17/27/37/47/57/67/77/87/97/107/117/127/137/147/157/167/177/187/197/207/217/227/23,1년 전(수정됨)
459,  아으초,팔굽혀피기랑 풀업하고 나서 이 운동을 해도 승모근이 낮아질까요 아니면 운동을 하지 말고 승모근 운동만 해야 할까요,1년 전
460,  행복한71억,00:52 오랜만에 다시 시작합니다! 아침 저녁12/21화 12/22수 12/23목12/24금,11개월 전
461,  오징어덮밥,와 세상에나 저 지금 너무 놀라서 바로 적으러 왔는데요ㅋㅋㅋ 와 효과 개쩔어요 지금 한 2주 정도 되려나..? 솔직히 귀찮아서 좀 일주일에 서너 번 정도 생각날 때만 했는데 와 완전 쇄골 어깨라인 와 너무 예뻐요 이런 말 하기 좀 부끄럽지만 제가 봐도 진짜 직각 어깨 너무 예뻐요... 여러분들 제발 꼭 하세요 해주세요 제가 이런 거 적을 줄 꿈에도 몰랐고 와 세상 행복해요 최고예요 땅끄부부님 사랑합니다...️️,1년 전
462,  다현,스트레칭을 할 때 항상 왼쪽은 자극이 잘 오구 오른쪽은 자극이 잘 안 오더라구요ㅠㅠ 혹시 이유가 있을까요??,3개월 전
463,  Lynn,아니 이거 예쁜 승모근 다 떠나서 진짜 졸래 시원함 어깨 스트레칭용 짱임,3년 전
464,  정혜란,양옆에 아이랑 끼어서 자느라 일어나서 어깨가 너무 아팠어요 기상 직후 땅끄 전신스트레칭 후 승모근운동합니다 통증도 많이 줄고 몸이 가벼워진 느낌이에요 오늘 하루도 땅끄부부힘 받아 힘차게 시작합니다 늘 도움 주시는 영상 감사합니다 ^^,1년 전
465,  박지욤,"매년 하다가 멈췄는데 ,, 이번엔 개강까지 멈추지 않을래요 ,,,,,1/7 ️",1년 전
466,  선인장,그림을 그리는지라 장시간 컴퓨터로 작업을 하는데 정신차려보면 엄청 거북목 자세로 모니터를 보고있더라고요 ㅠㅠ 요거 보면서 자기전에 한번씩 해보겠습니다 굳굳스며칠째 밤새면서 작업을 하니까 목만 숙여도 시원하네요 ㅋㅋㅋㅋ ㅠㅠㅠㅠ 인간거북이 멈춰...,9개월 전
467,  금비,이렇게 노래 넣는거 심심하지도 않고 좋은것같아요!,1년 전
468,  이뽀쨕,7/24 ️7/25 ️7/26 ️7/27 ️7/28 7/29 ️다시 시작…5/5️,1년 전(수정됨)
469,  sweetrain,얘기해주면서 운동하니까 지루하지않고 끝까지하게됩니닼ㅋㅋㅋㅋㅋㅋㅋㅋㅋㅋㅋ 운동만 알려주고 그러면. .유투브 구경만 보는뎋ㅎㅎㅎㅎㅋㅋㅋㅋㅋㅋㅋㅋㅌ,3년 전
470,  밈미,유튜브로 항상 눈팅만 하다가 처음 댓글 남겨보는데 전 진짜 작심3일 수준이고 작심3일도 길다.. 하루 하고 안하고 이런 스타일이에요 그런데 얼마전부터 어깨랑 승모근쪽이 계속 뭉치고 통증 때문에 일 하는데 지장이 갈 정도고 승모근이 너무 산처럼 올라와 있는거 같은 거에요 그래서 스트레칭이라도 하면 나아지지 않을까 하고 거의 한달정도 했는데 못할때도 더 많았어요 그런데 진짜 신기하게 승모근이랑 어깨 통증이 정말 많이 줄어 들었어요 뻐근한것도 그렇구요 어깨랑 승모근라인은 제가 했다 안했다 이런 편이라 드라마틱하게 이뻐진건 아니지만 예전보다는 승모근이 많이 사라진거 같아요 그 통증에서 벗어난게 너무 좋아오 ㅎ ㅜㅜ 간단해서 요새는 자기전에 한번씩 꼭 하고 꾸준히 해서 예쁜 어깨라인 만들고 싶어요!!감사합니다 땅끄부부님 ,1년 전(수정됨)
471,  ㄴㅇ,한달했는데 어깨뼈 라인이 눈으로도 보여요 게다가 등 굽은거 어깨 굽은거 다 펴졌어요 당.장.시.작.해.,1년 전
472,  ᅥᅡ,팔굽혀 펴기랑 병행해도 되나요??,6개월 전
473,  김 별화,5/65/75/85/95/105/115/12(어제 못해서 2번했어요!)5/13~16아파서 잠시 쉬러갑니다....5/175/185/195/205/215/225/235/24,1년 전(수정됨)
474,  짝남한테 이 계정 들키면 계정삭제,1일차: 겁나 개운함2일차: 완전 개운함(가족들한테 전파중)3일차: 엄마꼬셔서 같이하는중,1년 전(수정됨)
475,  911구일일,지긋이 눌러줍니다~~~~스트레칭 열심히 할게요!! 영상 감사합니다,4년 전
476,  고구마,작년에 하다가 효과보고 안한지 꽤 됐는데 여름에 오프숄더를 위해서 다시 도전3/4 ㅇ3/5 ㅇ,1년 전(수정됨)
477,  풉킥,이거랑 승모근 얼굴 붓기 같이 하는데 이거 하고 나면 척추측만증 때문에 왼쪽이 유독 승모근이 미친듯이 솟아있는데 그 딱딱한게 덜 아파짐… 없어지는 건 아직 잘 모르겠지만 확실히 이거 하면 승모근 많이 풀림 진짜 감사해요 ㅠㅠ,1년 전
478,  우현지,넥 숄더 릴리프 할 때 어깨 관절에서 뚝뚝 소리가 나는데 계속 해도 괜찮은걸까요?,10개월 전
479,  제리,12월 5일에 웨딩촬영해요!! 힘내서 매일 해보겠슴돠!!!!!️,1년 전
480,  ISFP,요즘따라 올라간 승모근이 내려가길! 8/17 하고나니까 승모근이 가벼워요!8/18,1년 전(수정됨)
481,  사람살려,아니 승모근~ 없다~ 할 때 옷깃 잡아당기는 것도 하는 건 줄 알고 따라 함 너무 웃겨 ㅠㅠ ㅋㅋㅋㅋㅋㅋㅋ,3년 전
482,  아빈,정말 궁금한게 있는데용 일자어깨 만들때 스트레칭밴드 쓰는방법도 있던데 그러면 더 근육이 생기는거 아닌가요? 오히려 승모근이 더 생길것 같은데.. 그냥 궁금해서 여쭤봐요..,1년 전
483,  이벱베,꺄 넘나리시원,1년 전
484,  ㅈㅅㅇ,승모근 릴리프? 할 때마다 어깨에서 뭐가 두두둑 움직여요ㅋㅋㅋㅋㅋ 얼마나 굳어 있었던 거야 10월 18일까지!10/5 10/610/710/810/9,1개월 전(수정됨)
485,  jun12,오늘 시작인데 쉬원합니다~,1년 전
486,  박하은,최대한 매일!7/11(월) ️ ️7/12(화) ️ ️7/13(수)  ️7/19(화)️ ️7/20(수) ️ ️7/21(목) ️ ️7/26(화) ️ ️7/27(수) ️ ️7/28(목) ️ ️--------------8/5(금) ️ ️8/6(토) ️ ️8/24(수) ️ ️8/25(목) ️ ️8/26(금) ️ ️8/27(토) ️ ️8/28(일) ️ ️8/29(월)  ️8/30(화)  ️,9개월 전(수정됨)
487,  재니,팔뚝살 운동영상 후에 바로 이 영상 이어서 하려는데 괜찮은가용??항상 좋은 영상 올려주셔서 너무 감사함ㄴ다!!️️,3년 전
488,  집에가고싶다,제가 어깨가 완전 앞으로 축 쳐져있었는데 이상하게 이 운동 때문인지 땅끄부부의 다른 운동 때문인지는 모르겠는데 쳐져있던 어깨가 조금씩 펴지면서 발달해있던 승모근에서 점점 직각이 되어가는게 눈에 보여요.. ㅎㅎ여러분들도 하루에 6분만 투자해서 열심히 해보세요 ㅜㅜ 몇십년 동안 뭉쳐있던게 운동 한번 하고 하루만에 달라지길 바라시는건 아니겠죠? 꾸준히가 가장 중요합니다 효과 없는 것 같다고 포기하지 말고 꾸준히 해 보세요 몸은 정직하기 때문에 힘들었던 만큼 그만큼의 보상이 따라옵니다!!,8개월 전
489,  기요미,항상 땅끄부부 영상 보면서 느끼는 건데 오드리님 어깨라인 너무 예쁜듯요...,1년 전
490,  김보경,승모근이 사라지는건 목도 얇아질수 있는건가요?,1년 전
491,  옐로파이,오늘부터 꾸준히 해보려합니다!승모근 스트레칭을 한 후 승모근 쪽이 당기는데 올바르게 스트레칭이 된 건가요?사실 승모근 스트레칭을 하기 전에 팔꿈치 바닥에 놓고 핸드폰하는 습관을 고쳐야 되는데ㅠㅠ 지금 댓글을 쓰면서도 무의식적으로 이 자세를 하고있는.....열심히 꾸준히 해보도록하겠습니당,1년 전(수정됨)
492,  m s,땅끄부부님 !! 제가 거북목이 심한데 이 동작들이 거북목에도 도움이 되는건가요?!!?,1년 전
493,  아잉,완전 게으름뱅이도 쉽게 따라할 수 있어서 좋네요 ㅠ,4년 전
494,  냐옹,7/12 (하루 한 번)7/13 일이 있어서 못 하고 잤어요 ㅠㅠ7/14 (1번)7/15 (2번)7/16 (2번)7/17 (1번)7/18  (1번)7/19  (2번)7/20  (2번)7/26  (1번)7/28  (1번)7/31  (2번)8/2  (2번)8/5  (2번)8/11  (2번),1년 전(수정됨)
495,  양갱,이거 연속으로 2~3번 해도 될까요?,1년 전
496,  유나 flora,몇개월간 아침마다 하는즁기록해보깅11/28 월 ️11/29 화 ️11/30 수 ️,2일 전(수정됨)
497,  안녕하세요?,"한달 후기하루에 1~2번 함어깨, 승모근 통증이 60% 정도 사라진 느낌승모근이 사라졌다고 생각하진 않지만 어깨라인이 잡히면서 밸런스가 맞춰진 것 같음 전에는 둥글 어깨여서 에코백 하면 흘러내렸는데 굽은 어깨가 펴지고 살짝 직각어깨가 되면서 흘러내리는 빈도가 줄어듬",1년 전
498,  카롱이,고정댓글보고 5일째 따라하고 있습니다♡,1년 전
499,  뚱이,저 이거 하면서 진짜 없던 쇄골 생기고있어여ㅋㅋㅋ 땅끄부부 짱!,1년 전
500,  밍밍이,우와 천만뷰 축하드려요,9개월 전(수정됨)
501,  이서서서서서현현현,일주일했거든요ㅜㅜㅜ돌같던 어깨가 말랑젤리가 되고쇄골도 드러나고있어요,1년 전
502,  ㅎㅇ,혹시 이거 하면 쇄골도 점점 나타나나요???,10개월 전
503,  jins H,꽃신D-21일 예쁜 그날까지 파이팅!!!3.22 3.23 3.24  3.25 3.29,1년 전(수정됨)
504,  이혜선,승모근에 살이 많이 쪄서 울퉁불퉁 해졌는데 이것도 교정 가능한가요?? ㅠㅠ잘못하면 더 악화될 수도 있다고 들어서..,10개월 전
505,  김은서,일주일 후기안 보이던 쇄골이 조금씩 보이기 시작합니다ㅜㅜ 한 달 도전합니다,1년 전
506,  S oo2,승모근 깡패입니다오늘부터 시작해보겠습니다6/15 ️6/16 ️6/17 6/18 ️6/19 ️다시 시작합니다!!…7/9 ️7/14 ️7/15 ️,1년 전(수정됨)
507,  shane k,시원해요옹~~,7개월 전
508,  김예은,건강을 위해 승모근 스트레칭!!7/26,1년 전
509,  준라Music teacher,6/17목 오늘도 시원♡,1년 전
510,  bluMoon,For myself: Starts 0:51,1개월 전
