,아이디,댓글 내용,댓글 시간
151,  정윤선,"승모근때문에 병원을 다닐 정도로 어깨가 많이 아팠는데 땅끄 운동, 스트레칭 하면서 많이 좋아졌어요! 거기다 이렇게 승모근 스트레칭을 따로 올려주시니 넘 좋습니다 어찌 이렇게 필요한 내용을 잘 엄선하시는지...!!  제가 어깨가 좁은 편인데다가 'ㅅ'자 어깨여서 슬펐는데, 어깨운동이랑 승모근 스트레칭 열심히 해써 떡벌어진 멋진 일자어깨 만들겠습니다 땅끄부부도 홧팅!! ",4년 전
152,  Li A,오늘부터 매일 아침마다 해볼게요!!! 목표는 당당하게 오프숄더 입을 수 있었으면 좋겠어요ㅜㅜ4/24 ️4/25 ️4/264/274/28,1년 전(수정됨)
153,  신라영,"승모근이 비대칭으오 왼쪽만 커서 3주전에 시작했습니다 아침에 일어나서 플랭크 10분 후 이 영상의 스트레칭을 해주고 씻고 나와서 하고 일하다가 점심시간에 하고 일끝나고 집와서 하고 자기전에 했습니다. 승모근이 어깨를 잡아주지 않는 느낌이 강했는데 이제 팔을 어디로 뻗어도 저린 느낌이 사라졌습니다! 동시에 승모근과 어깨 높이도 정상이 되었고, 말린어깨도 개선되었습니다! 이제 습관이 되어서 안하면 허전하네요!! 감사합니다 (꾸벅)",1년 전
154,  HJ,항상 작심삼일이었는데 이번에는 열심히 해볼게요!:)11/1611/1711/1811/1911/2011/22 어제 몸이 아파서 하루 쉬었어요 ㅠㅡㅠ 화이팅!!11/2311/2411/25,1년 전(수정됨)
155,  송은혜,"평범한 회사원입니다! 사람들이 제 승모근 보면 ㄹㅇ 놀랠 정도로 뭉쳐있고, 매일매일 아파서 마사지받으러 가는 게 일상입니당. (일주일에 두번 정도) 돈도 많이 나가고, 스트레칭 자체를 생각 못했는데 다이어트 시작하면서 스트레칭을 같이해주려고 찾아보다 이영상을 보게 됐는데 지금 8일차인데 뭉쳐있는게 풀리는 지는 사실 눈으로 잘 모르겠지만 아프고 뻐근한 거 사라졌어요. 와 진짜 특히 아침에 일어나자마자 자기전에 운동 전 후로 하면 진짜 너무 좋아요.. 진짜 한번 두번이 아니라 꾸준히 해주면 진짜 좋습니다 여러분... 제일 좋은 건 회사에 책상에 앉아서 따라할 수 있다는 점이에요! !",3년 전(수정됨)
156,  타피오카펄,이거 진짜 ㅈㄴ 좋은듯 어릴 때부터 하루종일 책상에 앉아있느라 목+허리 디스크 걸려서 특수책상도 써보고 도수치료 물리치료 다 받았었는데 베개 바꾸고 자기 전에 이거 한 번 해주니까 많이 나아져서 다니던 도수치료 끊음..,1년 전
157,  하얀바다mj,거북목이 된것같은데ㅜ 이 영상 한번 이 아니라 꾸준히 반복해서 어깨미인 되보렵니다^^책 출간 축하드려요~!!^^ 항상 잘되시길 바랍니다!!,1년 전
158,  ㅇ,일주일 했는데 효과 넘 좋아요..,9개월 전
159,  김참새,지금 왼쪽 승모근이 너무 아파서 따라해봤는데 뭉친게 풀려서 안아파요!! 감사합니다 자주 따라할게용,1년 전
160,  랄리경복,티비보면서 했는데 하루종일 무거웠던 어깨가 덜 아프고 시원하네요~~~꾸준히 해보고싶네요~~~^^,1년 전
161,  이나나,오프닝 넘 귀여워요 어깨쪽이 항상 뻐근했는데 스트레칭 따라하고 나니까 풀리는 느낌이에요 늘 좋은 영상 감사합니당 !,4년 전
162,  뿌링클티라미수,승모근 사라진건 그나마 유지됐는데 시험 때문에 목이 엄청 뻐근해져서 오늘부터 시작합니다5/13 1일차  새벽 완료 5/15 2일차  저녁 완료 (어제 못한거 포함)5/16 3일차  저녁 완료 ,1년 전(수정됨)
163,  박선영,2.24운동하다 어깨 살짝 삔것같아서 댓글 남겼더니 요거 알려주셔서해요세상에 넘 시원하고 어깨 삔것도 나아진것같아요!!! 감사해용,1년 전
164,  진,공부하면서 어깨가 많이 뭉친 것 같아서 잠깐 들어와서 했더니 어깨가 너무 쉬원하네요! 가끔씩 들어와서 할게요~,9개월 전
165,  이혜은,요즘 땅끄부부 영상들로 운동 조지고 마지막에 스트레칭 영상들로 몸 풀어주는데 개인적으로 난 이게 제일 시원한거가틈 ㅠㅠㅠㅠㅠ,1년 전
166,  메롱킹받네,일주일마다 후기 남기게 좋아요 좀 눌러주세요 부탁드립니다 ㅠㅠ1일차:생각보다 간단해서 놀랐어요️2일차:아파서 쉼용3일차:완료!️4일차:조금 효과가 보이는 것 같기도..? 그래서 그런지 조금씩 힘든 것 같아요️후기:귀찮아서 일지는 안 썼지만 꾸준히 해왔습니다 점점 없어지는 게 보여서 넘 뿌듯하규 좋아여 ㅠ 자세도 좋아지는 것 같고 처음엔 뭐가 달라진 거지라고 했지만 신경 안 쓰다가 봤더니 승모근이랑 안녕 했습니다 땅끄부부 사랑해여 화잇팅,8개월 전(수정됨)
167,  나이스혜지NICE HYEJEE,이거 일주일만 매일 하루에 2번이상 해줘도 승모근 처음보다 눈에띄게 들어가요.. 진짜 제 인생스트레칭 나만알수없어요 진짜 힘들지도않고 ㅜㅜㅜ 일주일만에 이정도면 한달 두달 매일하면 완전 일자어깨도 가능할거같애요 땅끄부부님 감사합니다 맨날할게요 ㅠㅠ,2년 전
168,  안유정,2주후기평소에 경직된 자세로 컴퓨터를 사용해서 어깨통증이 심하고 딱딱했는데 2주 동안 오전에 한번 오후에 한번 했는데 어깨 라인은 물론이고 어깨통증 아예 없어지고 말랑해졌어요 ꒦ິ^꒦ິ 넘 행복해여 여기저기 영업하는 즁입니다 ! 적게 일하시고 많이 버세요 감사합니다 ( ღ’ᴗ’ღ ),1년 전(수정됨)
169,  미소,매일 머리부터 발끝까지 찾아 따라합니다/감사합니다~영상 랜덤으로 찾아 맘껏 합니다~^^,1년 전
170,  남쪽이,운동 막 하다보니 어깨도 뭉치고 승모근이 더 올라와서 오늘부터 승모근 운동 갑니다!!!,1년 전
171,  ᄋᄋ,승모근 없애는 운동 다른 유튜버 영상 일주일 동안 했는데 승모근이 커지고 어깨도 완전 뭉쳤어요......... 땅끄부부님만 믿고 매일 하겠습니다 ㅠㅠ,1년 전(수정됨)
172,  이안눙안눙,내가 왜 어깨라인 이쁘단 소리를 들었는지 몰랐었는데이거 하다보니까 평소에 습관처럼 많이 하던 동작들이 많네용 ,1년 전
173,  이클립스,요즘에 땅끄부부 덕에 힙업이랑 승모근 효과 정말 톡톡히 봤어요!!ㅜㅜㅜ 혹시 o자 다리 운동도 옛날꺼 갱신 해주시면 안될까요?? 이런 영상처럼 함께 운동 하고 싶어용!!,2년 전
174,  𝙇𝙤𝙫𝙚 𝙞𝙨 𝙖𝙡𝙡,"승모근! 없~다  항상 운동을 끝 마친 후,  얼굴살 붓기제거 턱선 만들기 & 승모근 스트레칭은 필수로 하는것 같아요 :) 땅끄부부님들 입담이 너무 좋아요~~ 매일 듣는 이야기지만, 처음 듣는 기분 이랄까요?  항상 좋은 영상들 고맙습니다. 코로나19 때문에 운동도 바깥에서 하기가 좀 부담 돼서, 집에서 TV나 노트북으로 매일 땅끄부부님 영상 챙겨보며 운동 합니다 !! 덕분에 건강 해지고 있어요. 두분, 그리고 행운이 감기 조심 하시고 건강하세요!  화이팅입니다 ️️",1년 전
175,  Path Finder,앉아있는 시간이 긴 취준생입니다. 기자 준비하느라 오랜시간 앉아서 읽고 쓰다보니 몸에는 많이 소홀해졌어요. 매일 이거 보면서 운동해서 승모근 없애려고요! 선언하면 꾸준히 할 수 있지 않을까 해서 저도 인증합니다:) 제가 안 오면 불러주세요!3.23 3.24 3.25 ~ 27 3.28 3.29 필기 시즌이라 오질 못했네요 ㅠ 다시 꾸준히 하겠습니다! 불러주셔서 감사해요!4. 05 ,1년 전(수정됨)
176,  바니박BanniePark,승모근으로 마무리했고 이제 자러가야겠네요! 오늘도 감사합니다,9개월 전
177,  joy adorable,승모근 스투레칭1일차️땅끄부부 님  여러영상보며. 꼭한달만이라도. 꾸준히해볼게요  팔뚝도 5일차하고있어용 ㅎㅎ 모두 건강해져요. 화이띵ㅎㅎ2일차,1년 전(수정됨)
178,  리젤₊˚.༄,곧 중3되는 학생이고 제가 작년 겨울부터 목이 굽고 너무 아프기도 하고 허리도 슬슬 아파지는 것 같아서 이제야 운동을 시작해요 매일매일 할 수 있도록 해보겠읍니다!!12/20  (시작)12/21 12/22 12/23 너무 졸려서 못하고 잤어요ㅠ12/24 12/25 12/26 x12/27 12/28 12/29이날부터 허리 스트레칭만 출첵하기로 햇어요!12/3012/31,11개월 전(수정됨)
179,  so so,너무 따라하기 쉬워서 좋아요 안면비대칭이나 골반교정스트레칭같은것도 다뤄주시면 좋겠어요 ㅠㅠ,3년 전
180,  이쁜정,이거효과 좋아여 ! 한지 일주일도 안되었는데 하루 시간 날 때 마다 (하루 약 5회)  틈틈히 해주니까 승모근부터 어깨선이 예뻐져요! 그리고 제 어깨뼈가 만져졌습니다..네 여러분 다 같이 시행합시다,1년 전
181,  귤귤,1일차 매일아침 한번씩 꼭!!시작2일차 성공3일차 성공 벌써 쇄골나오고 승모근 통증이 덜해요 ㅜㅜㅠ4일차 성공5일차성공!6일차성공,1년 전(수정됨)
182,  박지수감자김동인새우,1:00 여름방학동안 꾸준히 해보겠습니다!7/297/307/318/18/28/38/48/58/68/78/88/98/108/118/128/138/148/158/168/178/188/19,6개월 전(수정됨)
183,  이재희,"스트레칭 하면서 새삼 제 어깨와 등에게 미안해졌어요... 왜 이제야 이 스트레칭을 해 주냐고 아우성이더군요..ㅋㅋ큐ㅠㅠㅠㅠ 진짜 너무 시원해요 ㅠㅜㅠㅜㅠ(사실 오른쪽 어깨 엄청 아팠던 건 안 비밀..) 한동안 운동도 안 하고 굴러다녔더니 승모근도 미쳤고 살도 많이 뿔어서 운동 ㄷㅏ시 시작해야겠어요,, 땅끄부부 덕분에 효과 많이 봤던 사람이라 땅끄부부는 언제나 제게 동기부여 해주시는 운동 쓰앵님이서요.. 정말루 사랑합니다,,",1년 전
184,  rhaostm,우왕~땅끄부부 채널이 워낙 유명하길래 궁금해서 한번 들어와 봤는데 왜 유명한지 알것같은 영상이네요 ! 너무 간단하고 시원해지는 영상 잘봤습니다 ,6개월 전
185,  freedom God,땅끄부부님 운동은 힘들지 않으면서 효과짱!♡,4년 전
186,  쿠와앙,오늘도 칼소폭+승모근 완료오오ㅎㅎ 이제 씻고 작은얼굴운동하고 공부하러 갈겁니다!! 오늘도 감사합니다 땅끄부부님 언제나 감사해요오!,1년 전(수정됨)
187,  sooni,이거 진짜 넘넘 시원해요,1년 전
188,  변다영,목이 결린다고 했더니 친한언니가 링크보내줘서 봤습니다 ㅎㅎ 정말 시원하네요 생각날때마다 할게요! 감사합니다,1년 전
189,  박지영,학교에서 스포츠시간에 열심히 따라하고 있어요! 고맙습니다^^,1년 전
190,  딜_,"효과 좋은 거 같아요 일주일에 서너번, 이주정도 했는데 오랜만에 본가 가니까 엄마가 얼굴살이랑 목 어깨라인이 갸름해졌다고 살 빠진 거 같다고 하셨어요 ㅎㅎ (몸무게 그대론데 ㅎㅎ) 키스실링? 그거 틈 날 때마다 하는데 턱살 빠지는데 진짜 좋은 거 같아요 상체가 진짜 콤플렉스였거든요 ㅜ 승모근이랑 이중턱, 라운드 숄더때매 진짜 스트레스 많이 받았는데 더 꾸준히 해보겠습니다 감사합니다!",1년 전
191,  탱크보이,지금은 매일 이 영상을 보며 땅끄부부님들과 같이 운동을 하지만 이 영상을 보지 않고 습관적으로 하게 되는 날이 오면 이미 승모근과 어깨모양은 예쁘게 잡히고 있는 중이니까 쉬지말고 계속 운동하자,2년 전
192,  지은이아이유의유애나,100일 완료 윳후승모근이 막 썸네일처럼 치솟아 있진 않았는데 어깨 뭉치는 일도 많고 거북목도 있었고 어깨도 좀 굽었고 그래서 살을 빼기 보다는 스트레칭 겸 거북목 완화를 목적으로 시작했습니다제가 목적으로 삼았던 부분들이 달성됨은 물론 승모근도 빠지고 어깨 라인이 깔끔해졌으니 더없이 좋네요학생 신분이다 보니 무의식적으로 승모근과 어깨에 무리를 주는 일이 많은데 목표로 잡았던 100일의 기간은 끝났지만 생각날 때마다 해주면 좋을 것 같아요옆에서 코칭해주는 듯한 영상 만들어 주신 땅끄님과 오드리님께도 감사드립니다앞으로도 다양한 운동으로 함께 해보겠습니다!!!,1년 전
193,  맛있는바나나,아પ 이게뭐야.. 진짜 댄스부 공연에서 옷을 입어야 하는데 승모근때문에 안예뻐보일까봐 승모근 없애려구 이거 시작했거든요..오늘 처음 했는데 진쨔 너무 너무 시원하고 거북목도 없어진느낌이에여 어깨도 막 펴져여 진짜 사랑해요ㅠㅠ 앞으로 매일 할게요,1년 전
194,  성이름,진짜 일주일째까지 왜 효과가 안보이지 했는데 일주일째 밤에 세수하고 거울을 봤는데 뭐지 미친 육성으로 나옴. 일주일까지는 쇄골까지는 모르겠는데 승모근이 진짜 많이 없어짐..진짜 2주만 속는 셈치고 하면 후회 절대 안함..!,8개월 전
195,  김우내,승모근 너무 심한 중학생인데 오늘부터 매일 영상 보고 따라하기 도전하겠습니당0:55 시작11/14 : 11/15 : ...11/18 : 넥숄더릴리프할때 어깨가 드르륵드르륵...11/19 : 11/20 : 11/21 : 11/22 : 11/23 : 11/24 :  내일은 꼭..11/25 : 11/26 : 11/27 : 11/28  : ,1년 전(수정됨)
196,  성이름,와 그냥 영상보면서 다 따라했는데 너무 시원해요 진짜 최고에요 앞으로 계속하도록하겠습니다 땅끄부부 사랑해요!!,2년 전
197,  eong.j,2/17 2/18 2/192/202/212/22 (3/3)2/23 (3/3)2/24 (3/3) 효과는 둘째치고 항상 뭉쳐서 아픈 어깨가 풀리는 느낌....너무 좋다...2/25 (1/3)3/4(1/3) 많이 건너뛰었다3/5 (1/3)3/23 오랜만에ㅋㅋㅋ귀찮음을 이길 수가 없다...(1/3)4/4 다시 오랜만에 복귀! 댓글을 안 남겼을 뿐 하긴 했다4/5 (3/3)4/9 (1/3)4/10 (1/3)4/11 (3/3)4/12 (2/3)4/13 (2/3)4/15 (1/3)4/18 14/ 21 14/22 (1/3)4/25 (1/3)4/26 (1/3)4/27 (2/3)4/30 (1/3)5/3 15/10 ,1년 전(수정됨)
198,  린은,아직 4일만 했지만 공부 할 때 정말 어깨가 많이 아프지 않아서 좋았어요! 평소 어깨결림도 자주 생겨서 힘들었는데 ㅠ̑̈ㅠ̑̈ 오래 앉아도 요즘은 별로 힘들지 않아 좋아요.,1년 전
199,  맛고구마,아침저녁으로 최대한 하려고 하고있는데 진짜 별거없는거 같지만 효과좋아요 모니터도 오래보고 앉아있는 시간 넘 길어서 거북목이랑 승모근 개심각했는데 산처럼 솟았던 승모근이 조금씩 없어지고 있어요 !!식이조절하면서 다이어트랑 같이 하고있어서 더더욱 그런거같아요 시간도 짧아서 부담도 없구 편하게 앉은 상태에서 할 수 있어서 너무 좋습니다,6일 전
200,  가나다라마바사,승모근이 심각한걸 깨닫고 어제부터 시간날때마다 스트레칭 해줬는데 확실히 어깨도 가볍고 기분탓인지 승모근도 살짝 내려간 것처럼 보임. 그동안 ‘에이 이런 거 한다고 달라지겠어?’ 라고 생각하면서 미루곤 했는데 속는 셈 치고 한 번 따라해보니깐 확실히 뭔가 달라지긴 했어요!! 다들 한 살이라도 젊고 어릴 때 시작합시다 진작에 안 따라한 게 후회스러울 정도예요..,1년 전
201,  Rachel,너무너무 시원 합니다~ 시간 날 때마다 꼭 오도록 하겠습니다!화이팅 !!!!!!!,1년 전
202,  김민,오늘 처음했는데 진짜 오지게 시원하네요,1년 전
203,  나..천재.,"제가 이거 이주 동안 틈틈이 하면서 승모근도 마사지 해 줬는데, 친구들한테 얼굴살 빠지고 갸름해 졌다는 소리 계속 들어요 승모근도 물론 눈에 보일 정도로 사라졌어요 얼굴 살 빠질 줄은 진짜 몰랐어요..사랑해요 땅끄부부...",1년 전
204,  한빛,0:53 1일차 승모근 없어지길 ㅠㅠ2일차3일차 오늘은 2번이나했어요(알바할 때랑 운동 마지막때!!)4일차도 왔어효 ㅎㅎ5일차 ️6일차 7일차 벌써 일쥬일8일차용9일차! 아직까진 효과 모르겠당 꾸준히 해야지10일차 벌써!11일차입니당 오늘은 스카에서 하깅12일차!13일차 스카에서 함용14일차 아 오늘 기말고사 첫날 그냥 망했어요^^15일차 어젠 공부하느라 못했네ㅠㅠ 오늘은 시험 셋째날 시험 나쁘지 않아씀 !!16일차!17일차! 일요일 출쳌18일차 시험 끝>_< 이제 종강19일차 오늘은 운동하고 오빠 만나렁20일차! 오늘은 오빠 만나고 집 와서 윤동 오랜만에 유산소 갑니다21일차 3주차!22일차 끝나고 집에서 유산소(오늘은 )23일차 오늘은 토요일!24일차 오늘은 이료일! 곧 30일차 되간당 오늘은 왜 승모근이 아픈거죠25일차 승모근이 왜 아프지 잠을 잘못잔건지 베개가 이상한건가 어제 일어나서부터 아픔 ㅠㅠ26일차 오늘은 다유니랑27일차 마지막은 이걸루 ~~28일차 오늘은 다유니랑 근데 몸살감기인지 코로나인지 죽어가효29일차 벌써!30일차 벙써 한달?31일차 우왕32일차욤 ㅎㅎ33일차 수요일~!34일차 오늘은 알바 하면서~!35일차 어제 잠깐 하고 손님 개와서 못함 다시 시도해보죠36일차 오늘은 홈트 전에 근력운동 먼저 조졌더니 제가 조져졌네요..37일차 오늘은 이료일38일차 벙써!?39일차 화요일~!~!~ 담주 월욜부턴 이제 출근.......천국 끝..40일차 벌써!?41일차 목요일~!~!42일차 신지니 하나 추가했다고 죽을듯 ㅠㅠ팔 고장남 (7/8)43일차 오늘은 이거 하고 바로 물놀이갑니댜44일차 내일 출근 해야하니 빨리 해볼게횽45일차  오늘은 퇴근 하자마자 바로 운동 ㅠㅠ 더워요 너무나46일차 화요일~!~!47일차 오늘은 저녁에 합니다 왜냐면 다윤이랑 의찬이를 만나고 왔고든용48일차 오늘 목요일 듣이어 운동하기 전에 오랜만에 햄버거 먹었는데..그냥 참을걸.7..777^^.....49일차 이틀을 쉬었더니 찝찝 다시 열심히 합시다 아자아자 !!!(7/17)50일차  여름휴가 다녀와서 6일만에 홈트합니댜! 다시 가보자구!!!!!!(7/23)51일차 7/2452일차 7/26 후후 다시 각성하자,6개월 전(수정됨)
205,  차연주,오늘부터 해서 승모근이랑 말린 어깨 다 박살내려고 합니다ㅠㅠ 안오면 댓글로 좀 불러주세요 다들 파이팅!12/2712/2812/2912/301/11/2 -기분 탓인지 모르겠지만 운동 하고 마지막에 스트레칭 하면서 이 운동도 같이 해줬더니 승모근이 들어간 거 같아요.. 늘 좋은 운동 영상 올려주시는 땅끄부부님 감사합니다️1/31/41/5,2년 전(수정됨)
206,  웅꾸,팔 운동하고 승모근 스트레칭 필수!등 운동하고 나서도 필수!!6.26  처음에 목 찢어지는 줄,1년 전
207,  묘묘,여름이라 다시 진짜빡세게갑니당 ㅠㅠ!! 쇄골라인아 나와다오 화이팅 1회완료요 ㅎㅎ 좋은영상감사해여 ️,1년 전
208,  경밍,"저는 진심 반팔만 입으면 옷걸이핏이 나올 정도로 여자지만 승모근이 너무 솟아있고, 또 뭉쳐있는 편이었어요 ㅠㅠ 그래서 오프숄더, 민소매는 커녕 반팔 면티 입는 것도 너무너무 싫어했는데요, 이 영상을 만난 뒤로 반팔 옷 핏이 정말 달라졌어요!! 3달동안 하루에 한 번씩 해주려고 노력했는데 중간에 며칠씩 쉬기도 하고, 까먹은 날도 있었어요 ㅠㅠ 그렇지만 진짜 두드러지게 효과를 봤어요! 살은 그렇게 많이 빠지지 않았는데 주변에서 옷핏이 달라지니 살 빠졌냐는 소리도 많이 들었구요 ㅎㅎ 제가 어깨랑 목이 정말 뭉쳐서 만성 두통, 어깨결림으로 고생을 많이 했는데 이 영상을 따라한 뒤로는 그런 거도 없어요!! 단 며칠 쉬면 다시 살짝 올라오는 느낌이 들어서 정말 꾸준히 하긴 해야할 것 같아요 이 영상을 만나서 너무 다행이고 행복해요.. 땅끄 짱!!",1년 전
209,  hana,이거는 운동 다하고나서 맨마지막 스트레칭으로 하고있어요!!!생각날때마다 하는중!!!♡♡♡♡,1년 전
210,  yamamamii,아침 저녁 한 번씩 하루엔 총 두 번 하세요 한 달 좀 안 됐는데 효과 쩔어요 진짜루… 승모근 사라지고 어깨 라인 진짜 예뻐지고 승모근이 줄어서 그런지 목도 길어 보임 ㅎㅎ,10개월 전
211,  김선율,아내분을 너무 귀여워하시네요 꿀떨어져요 ㅎㅎ  다른 운동 영상 보면 뭔가 엄청난 사람들 같고 너무 폼나고 운동에 하루 절반은 쓰는 것 같아서 엄두가 안나고 하다가도 지치고 딱히 도구도 없고 자세도 어려워서 포기하게 되는데 오늘 어쩌다 만난 이 유투버님들 덕분에 앞으로 열심히 재밌게 운동할 수 있을 것 같아요~  팔뚝살 운동 하다가 어깨깡패되면 어쩌나 하는 걱정도 있었고 푸시업하기에는 손목이 너무 안좋아서 속상했는데 팔뚝영상에서 희망을 보고 어깨스트레칭 영상으로 힐링하네요  피드백도 잘 해주시는 것 같아 더욱더 믿음 갑니다 ㅎㅎ 느므조아여 짱짱,4년 전
212,  싸비하면쌀거같아요진짜로,평소에 종종 스트레칭을 해서 승모근 짱!! 부자는 아니지만 공부하다 보면 뭉치는 기분이 들어서 좀 그랬는데 제대로 시작해보려구요!! 지나가시면서 알림 하나씩만 부탁드릴게요!!20212.16 2.17 2.18 2.19 2.20 2.21 2.22 2.23 2.24 2.25 2.25 ,1년 전(수정됨)
213,  다브,대체 이게 뭐죠ㅠㅠㅠ 왜 이걸 이제 알았을까요 하루 2번 했는데도 원래 승모근 진짜 돌처럼 딱딱했는데 이거 하고 나니까 말랑해졌어요ㅠㅠ 진짜 꾸준히 해볼게요 감사합니다!,1년 전
214,  서나,여름방학동안 실천!!!1일차) 조금 아픔2일차) 아픈게 덜 해짐3일차) 시원함 어깨 뭉친게 풀린 느낌,4개월 전
215,  보라칭구,오늘 목을 삐끗해서 엄청 아팠는데 이거 한번 하니까 싹 풀렸어요ㅠㅠㅠ,1년 전
216,  천희망,승모근 스트레칭 이거랑 다른 승모근 스트레칭병원 입원 중에도 계속 하고 있는데 와 두통도 승모근도 풀리네요매일 하게 되는 스트레칭입니다!^^,6개월 전
217,  현쓰파파,외국언니들 영상 따라하다가체중감량이 1도 없어서 요즘은 땅끄부부 영상만 쭉 따라하고있어요 전신10분-뱃살9분-뱃살칼로리5분-팔뚝16분-팔뚝8분-다리예뻐지는17분그리고 스트레칭도 매일 꾸준히 따라하고저녁에 시간나면 허벅지운동 추가로 따라하는데 정체기 극복해서 10일만에 -2kg 감량했어요 아직 목표달성하려면 한참 더 달려야해서 앞으로도 꾸준히 따라할계획이에요 땅끄부부님 영상은 같이 하고있다는 느낌이 들어서 정감이 든달까영상에 애착이 생겨요 ㅋㅋㅋㅋㅋㅋㅋ오드리님 넘 귀여우세요 땅끄부부님 영상과 함께 여름이오기전에 목표달성하길 바래봅니당!!,4년 전
218,  유케신,오늘 처음 따라해봤는데 너무 시원해요 하루 한 번씩 와서 해야겠어요3/73/83/9,1년 전(수정됨)
219,  Gloria Kang,땅끄부부는 따라하기도 쉽고 효과적이라서 좋아요 ㅎㅎ,1년 전
220,  루피루피마슈퍼루피루피루피,하루의 끝을 운동으로!! 11/21 월  하체11/22 화  상체11/23 수  하체+유산소 —> 아 진짜 죽겠어요,8일 전(수정됨)
221,  Jee-In Pyun,"결혼하고 단시간에 살이쪄서 눈바디 하기도 싫고 운동도 하기 싫은데(자신감은 바닥행...) 땅끄부부님 영상 보면 꼭 곁에서 같이 해주는 트레이너 같고 차분한 코칭에 진짜 기분이 좋아져서 마지못해서라도 하게됩니다^^좀만 힘들면 자세꼼수부리는 저같은 사람 북돋우며, 동작도 자세히 알려주시며,그 웃음과 농담까지 곁들여 주시니정말 대단하고 감사하다는 말씀밖에 드릴것이 없네요..특히 운동하며 싱글벙글 웃는 표정이 화면넘어서까지 파이팅을 줍니다!!!!!!! 엄청난 원동력이에요!!!!!!얼마후에 제가 꼭 좋은 효과보았다고 댓글남길 수 있게 응원해주세요두분께 행복이 가득하시길 바랍니다 감사합니다",1년 전
222,  쑴 ssum,자기 전 매일 해주도록 해보겠습니다! 살은 빠지고 있는데 승모근이 도드라져서 보기 안 좋았는데 마침.. 제 알고리즘에..️,7개월 전
223,  뀨,제가 평소자세가 안좋아서 어좁이에 말린어깨였는데 이 영상 매일 꾸준히 따라한지 한달 좀 넘었어요 우연히 차에 앉아있다가 백미러에 비친 제 어깨를 보고 깜짝놀랐어요 어깨가 펴지고 점점 일자어깨가 되어가고 있어요ㅠㅠㅠㅠ 어깨라인이 예뻐진게 확실히 눈에 보일정도에요!!! 땅끄부부님 영상 이거말고도 몇개 더 따라하는거 있는데 정말 재밌고 혼자 운동하는 느낌도 안나고 간단하고 쉬워서 너무너무 좋아해용ㅎㅎ 늘 좋은 영상 감사드리고 앞으로 더 예쁜어깨 만들 생각하니 더더 열심히하게되여 하루도 빠짐없이 열심히 해서 내년 여름에는 오프숄더도 많이 입을꺼에요><,4년 전(수정됨)
