,아이디,댓글 내용,댓글 시간
126,  @user-nr5qx4ev3u,"넘 좋아요 허리물리치료 하다 친구권유로 매일합니다, 병원치료보다 이 운동이 더 효과가있네요 감사합니다 매일 즐겁게 하고있어요!!",9개월 전
127,  @user-cm1pr2tl8y,이거 요가하니 허리가 시원해져서 놀랐어요! 감사합니다.,3년 전
128,  @user-pv3jf7yo8z,감사합니다요즘척추가  약해서 아팠는데척추요가너무좋습니다^^~,1년 전
129,  @user-eq6oi5nx7b,오늘도 고맙습니다   요가소년님!시원한 아침입니다~,1년 전
130,  @yoojookim8102,"안녕하세요^^매일 꾸준히 하는 요가 수련생입니다~이번 올라온 허리강화시퀀스가 허리 아픈자에게는 좀체 쉽지 않은 동작을 처음부터 하여 무리가 오는 것 같습니다.가끔 엄마랑도 하다 좋은게 있음 같이 하는데 이번 영상 뜨자마자 2번 정도 해봤는데 좀 불편함이 있었습니다.다음에는 목 어깨 스트레칭처럼 허리를 풀어주는 15분가량 강의가 올라왔음하는 희망에 댓글 남겨요~아기자세 비둘기자세 브릿지자세 등  쉽게 따라하면서 풀어준다는 느낌으로 ㅎㅎ매일 같이 하면서 뻣뻣하던 몸도 많이 풀어지고 혼자서 따라하지만 1:1수업 받는 느낌으로 너무 좋습니다.가끔 수련에서 탄력받아서 그런지 호흡이 빠른 부분이 있는데 첨에는 빨라 따라하기 바빴지만 익숙해지니 저도 같이 탄력받아 호흡에 무리없이 잘 따라가고 있습니다.또 부탁드리고 싶은게 혹시 다음에 태양경배자세를 한번 더 하신다면 1,2를 나누지 마시고 합쳐서 호흡을 한 템포 더 천천히 진행은 어떠신가요?천천히하는 태양경배자세 역시 매력적일 것 같습니다.항상 감사합니다^^",4년 전
131,  @user-on3ps8oj6y,허리통즐으로  고생하는데 한의원도다니면서  이영상  매일 잠들기전에  하고있어요~ 통증많이  좋아졌어요  영상  감사합니다,6개월 전
132,  @user-rx6uq4rg3l,나마스떼 수련하기 전에 머리가 좀 아팠는데ㅠㅠ 수련하고 나니 나아졌어요요가소년 채널은 타이레놀!,2년 전
133,  @user-zg8qz5tw1r,허리가 안좋아 자주 삐끗하는데 막상 해보니 허리 근력 키우기에 많은 도움이 되겠어요.제 몸에 관심을 갖고 도움받을 수 있는 영상 공유해주셔서 감사합니다.,4년 전
134,  @scarlett3123,감사 합니다. 오랜만에 서서 일을 했더니 허리가 너무 아팠는데 딸아이의 추천으로 해봤습니다.며칠 따라 해보고 좋아지면 꾸준히 하겠습니다.감사 합니다.,1년 전
135,  @yeryungmom,"오늘 2개 영상 따라 했어요 오전 ㅣ개, 오후 1개 ..몸이 안좋아서 쉬운것 골라 보는데 정말 좋아요",1년 전
136,  @user-ll3qx4my8j,예전보다 코어가 강화된걸 느꼈어요~ 매일하는 수련에 조금씩 단단함이 더해지네요. 나마스테,1년 전
137,  @bonmigu7182,"와아.. 좋은것 같은데 다리 들어서 다리, 팔교차하는 동작할때 몸이 덜덜 떨리더라구요.. 하면서 끙끙 소리 내면서 너무 힘들면 영상 멈추고 쫌 쉬었다가 다시 시작하고.. 끝까지 했어요~ 오우.. ",1년 전
138,  @gahrahm11,설명을 차분히 잘해주셔서 화면을 보지않고 잘따라할수있었읍니다. 3 년동안 매일 한시간씩하다가 넘어져 뼈를 다치는바람에 그만둔지 일년하고도 반년이 더지났네요. 매일 시간되는대로 따라 해볼려고해요. 감사합니다.,2년 전
139,  @sookim9002,"요가소년님, 요새 업뎃을 자주해주셔서 수련을 실시간으로 하는 느낌이에요~~ 오늘도 꿀잠 미리 감사합니다!^^",4년 전
140,  @user-lx3gw1og9h,매일잘 따라하고있습니다감사합니다~~^^,1년 전
141,  @user-pw3qk9wk8r,감사합니다 허리시술받고 재발되어 힘들었는데 덕분에 많이 좋아졌습니다,3년 전
142,  @user-qv7bu4qi2o,며칠 했는데 허리통증이 호전되는거 같아요.. 계속 해보려구요!!,1년 전
143,  @user-dl1jw2ei6k,진짜에요 허리 아플때마다 따라하고 있는데 하기 전과 후가 정말 달라요 감사합니다ㅜㅜ,1년 전
144,  @user-jr9vu8ls7c,테니스레슨받고 엉덩이골반척추쪽 통증이 급생겨서 이 시퀀스를 따라했더니..끝나고 일어나 걷는데..통증이 줄었어요..신기합니다!,1년 전(수정됨)
145,  @dongjooyun3570,2달 반동안 거의 매일 따라하고 있습니다매일 1개월 따라하니깐 일상생활에 큰 지장이 없을 정도로 좋아졌어요. 그래도 늘 조심합니다2개월 이후부터는 일상생활을 다하고 있어요. 항상 자세를 바르개 하려고 노력합니다. 덕분에 허리와 목이 정말 좋아졌어요감사합니다복 많이 받으세요,1년 전
146,  @seunghyunlee5272,허리가 아파서 시청하게 됐는데 코어근육이 심하게 없다는 걸 확인했습니다. 초반에 척추 좌우 스트레칭하는데 배가 어찌나 땡기는지 저한테는 복근운동이었습니다. 자체휴식하며 따라갔어요ㅋㅋㅋ 이렇게 코어근육이 없어서 허리가 아픈건가 라는 생각도 들었어요. 좋은 영상만들어 주셔서 감사합니다. 매일매일 따라하겠습니다 :),1년 전
147,  @juriamoon1598,설명하나하나 동작하나하나 따라하다보면 몸이 개운해져요~꼼지락꼼지락 기분좋아져요~~,1년 전
148,  @user-eq6oi5nx7b,요가소년님! 오늘도감사합니다   넘무좋아서 지인들한테  자랑하고  권합니다   요가소년님!  최고최고,1년 전
149,  @user-pt9pr8xz2f,허리 디스크로 고생중인데 어쩜... 하고 나니 통증이 사라졌어요. 왜 진작 몰랐지 ㅠㅠ 너무 감사해요!,3개월 전
150,  @user-kx2ou9uy5s,생리통으로 허리가 아팠는데 이영상 따라하고 너무 시원해졌습니다^^,1년 전
151,  @seungheeroh8267,"요가소년님 덕분에 매일 즐겁게 수련하고 있습니다 : ) 질문이 있는데요,  이 영상에서 같은 동작을 하면서도 호흡을 바꿔서 진행하셨잖아요~?? 그건 어떤 효과? 차이가 있는지가 궁금합니다!",1년 전
152,  @user-rz4qp6zd5j,주말의 마무리도 역시 요가롭게♡♡♡,1년 전
153,  @dianapark5462,이 요가운동 참 좋네요: 50분 했으면 하는 바램이네요!,3년 전
154,  @7im518,영상 감사합니다~ 좋은 하루 되세용,4년 전
155,  @Radiodog81,후반부 동작에서 좌골근처 척추부위에서 우두둑 소리가 나서 깜짝 놀랐습니다. 통증은 없고 시원함만 있었네요. 감사합니다 :),1년 전
156,  @honeybear8903,저도 허리통증때문에 고생 많았는데 몇개월 살살하다보니 엄청 좋아졌어요.  살도 좀 빠진거 같구요. 감사합니다,2년 전
157,  @hyerinpark875,감사합니다.  허리가 아팠는데 시원해졌어요.,1년 전
158,  @user-dh7qm7kc1w,지금부터 몸과 마음의 휴식을 시작합니다. 마법처럼 진짜 휴식하는 시간이 되는 것 같아요. 오늘도 감사히 수련 했네요~ 나마스떼!,1년 전
159,  @user-md3gn6xv5q,아침에 허리가 갑자기 아파서 이거보고 했어요. 한결 좋아졌어요.  감사합니다,4년 전
160,  @yschoi1138,아침에 한번 걸렀다가 하루가 힘들었어요. 한의원가는것보다 효과가 좋습니다. 통증이 줄어 삶의 질이 달라졌어요. 정말 감사합니다,1년 전
161,  @user-mt9qj6jh7b,허리가 시원한 느낌이 들어요 감사합니다!!,3년 전
162,  @user-id1nd2so3b,허리 안좋은데 하고나니헐씬 가볍고 개운함을 느끼네요구독.좋아요 꾸우욱~영상 감사합니다나마스테,1년 전(수정됨)
163,  @user-ll5wj9iz2u,요즘 자기전에 요가소년 요가 따라하고 자는 습관이 생겼어요차분한 목소리와 힐링되는 동작 하나하나가 몸을 정돈시켜 주는것 같아요.좋은 영상 많이 올려 주시길 바래요^^ forever~~감사합니다 ,1년 전
164,  @user-zi2lh3cq4d,허리 통증 이. 많이 부드럽고 좋아요감사드려요~~^^,1년 전
165,  @user-zn7ss8ci8u,허리아픈날 알고리즘이 이 영상을 추천해주었다. 효과는 굉장했다. 감사합니다!,2주 전
166,  @user-yg8ns4rp5k,힐링되네요  감사해요,1년 전
167,  @user-vx6jm7gd8i,"요가소년님, 저는 척추질환으로 고생을 하는 사람인데 병원에서 운동을 권해서 러닝만 하다가 최근에 유투브 보면서 15분짜리 허리통증 완화 요가를 병행하고 있어요. 오늘 처음으로 이 시퀀스를 따라해 보았는데, 제가 요통만 있는게 아니라 하복부 통증도 같이 있어서(의사샘 말로는 척추신경때문에 그렇다고 해요) 이 시퀀스를 하니 복통이 심해져서 중간에 멈췄다가 나머지만 이어서 했거든요. 허리는 오히려 더 부드러워졌는데, 동작을 따라하면 복부에 힘이 들어가면서 땅기니까 이 시퀀스는 저한테 안 맞나 싶어 질문드려요. 아니면, 배가 안아프고 괜찮은 동작만 선택적으로 따라하는 것은 괜찮을까요?",4년 전
168,  @user-xu3ts5ve3b,너무  좋아요 뼈에서 두두둑 시원해지는  제자리로  뼈들이  정렬하는것같은  감사해요,2년 전
169,  @user-sq3ze9tm1d,종일 허리통증으로 고생했는데 요가따라하고나니 통증이 많이 줄었네요 신기합니다,2년 전
170,  @user-np7cn1gy9m,너무신기해요 날개뼈 너무아파서 잠을잘모잘정도였는데 꾸준히했더니 너무좋아졌어요 잠도잘자구요 너무감사해요^^,10개월 전
171,  @user-ct1ic6wz2b,오늘 처음 해봤는데 데드버그 동작할 때 너무 힘들어서 이 영상은 나랑 너무 안맞는다고 오늘 하루만 하고 끝내자 싶었는데 다행히 이후 동작들이 그렇게 힘든 동작들이 없어서 앞으로도 가능한 한 쭉 해보려고요! 좋은 영상 감사합니다!,1년 전
172,  @user-dr4fx1ik1z,허리가시원해요~넘좋아요!!!매일매일 ~~~,1년 전
173,  @mjrosa4047,"통증완화라는 것이 어떤 것인지를 제대로 느끼게 해주는 프로그램입니다. 골반은 삐뚤고 허리는 측만증이 있어서  양쪽 다리의 길이가 다른데,  하고나면 시원해져서 놀랐습니다.  소년님의 들숨날숨이 ^^ 그 자체로 힐링이 되네요. 말씀하신대로 내일도. 모레도 도전해볼께요. 늘 감사드립니다.",3개월 전
174,  @user-eq6oi5nx7b,요가소년님!오늘도 감사합니다 1시간 이상 척추요가햇습니다 기분좋은 아침입니다~요가소년!최고!,1년 전
175,  @user-yu2st7er6l,요새계속 하루종일 좌골신경통때문에 불편했는데 이거하고 중간에 한번일어섰는데 정말 괜찮아졌어요 신기해서 끝까지 마저 다했어요 매일 해야겠어요 감사합니다,4년 전
176,  @user-xd2gl7xy3d,전 운전직인데 허리 어깨 어렵지않으면서 시원합니다정말 감사합니다,1년 전(수정됨)
177,  @user-rb1fs8rs3s,수고 하셨어요 고맙습니다,10개월 전
178,  @user-xl4ry8rc9n,5월챌린지 4일차완료~^^감사합니다 ♡,2년 전
179,  @user-rk7tc6cq8l,허리 뿌서질것같은데 ㅠㅠ 꾸준히 따라할게요!!!2/20 ,1년 전
180,  @gracej4522,"요가소년님, 늘 좋은 영상 감사해요^^ 혹시 초반에 누워서 손 발 바닥가까이 움직일때 등과 허리는 바닥에 붙인 상태로(코어에 힘을 준 상태로) 진행하는게 맞을까요?",1년 전(수정됨)
181,  @user-lb3xk7gc3q,진짜 신기한 게 이 영상을 집중해서 하고 나면 마지막에 꼭 깊은 잠에 들었다가 개운하게 깨어난 느낌이 들어요,4개월 전
182,  @user-pe3mx3qm2c,매일매일하고있어요넘  감사드립니다,1년 전
183,  @user-qm8lw2dp9e,허리가 한결 시원해요오늘 복 받았습니다.,1년 전
184,  @user-ri9iw3oo2k,요가수업 감사합니다.,2년 전
185,  @user-pt9pr8xz2f,오늘도 감사합니다,3개월 전
186,  @user-jf8uo6yq7f,오늘은 새벽부터 허리가아파 잠이 깨버려서 영상을 켰네요.  다시 잠들 수 있게 됐어요 감사해요,1년 전
187,  @user-ni3vs9fh5n,설명하시느라 수고하심에 감사드려요.쉽게 따라할수있었습니다.나마스떼~^^,1년 전
188,  @susankim2667,오늘도 감사합니다 ~ 요가 수련은 소중한 시간...  나마스테,1년 전
189,  @user-bm3nz9ci1l,ㅠㅠ하도 골골대고 허리통증 때문에 검색했는데..제 상태에선 빠르게 하는 요가 단체수업보다 소년님 영상보며 집에서 하는게 훨씬 낫겠다 싶네요ㅠ 영상 감사합니다,1년 전
190,  @user-eq6oi5nx7b,오늘도 요가소년 감사합니다 1시간이상 수련했습니다  다음시간에 또뵙게습니다   좋아요 누르고갑니다,1년 전
191,  @user-pt9pr8xz2f,오늘도 감사합니다,3개월 전
192,  @dragonrainpark8747,시큰 거리던 오른쪽 허리가 시원하게 풀리는 느낌 아주 좋아요!  달마다 1짜가 들어가는 날에 해요. 오늘이 10월1일 1짜가 들어있는 그 날이네요.  나마스테!,1년 전
193,  @user-gb1bc8kv8r,좋은 동작 알려주셔서 고맙습니다.,7개월 전
194,  @user-eq6oi5nx7b,요가쌤! 오늘도 감사합니다,1년 전
195,  @user-xd8on7pn8k,어제부터 구독가입~!!열심히 따라하다보면 좋아지겠죠?편안한 보이스와 지도감사드립니다,2년 전(수정됨)
196,  @user-rw1xt5wx3u,허리 삐끗해서 거의 1주일~2주째 아침마가 이거 하고 있어요*-*,1년 전
197,  @user-vx5eo3df8i,최고입니다 ,2년 전
198,  @pengvi4938,허리가 불편하여 오늘아침은 이것으로 합니다. 감사합니다. !,2년 전
199,  @user-pt9pr8xz2f,오늘도 감사합니다,3개월 전
200,  @user-fe9ly9yv2g,210503 따로 또 같이 하루일과 마치고 잠자리에 들기 전 수련을 해서 비록 시간은 04일로 흘렀지만 너무 개운하게 몸이 풀려서 나른나른 잠도 잘 잘거 같습니다오늘도 감사합니다 나마스떼,1년 전
201,  @yhi8525,안녕하세요 오늘 무거운걸 많이 들었더니 허리가 지끈지끈 계속 아파서 유튜브에 있는 온갖 척추 교정운동 통증완화 운동을 따라하다 우연히 알고리즘에 뜬 이영상을 보게 되었습니다. 평소 따라하던 교정운동과는 달라서 이게 맞나 싶다가도 잔잔한 목소리에 이끌려 끝까지 따라하게 되었는데요. 정말 끝내고 나니 시원한 느낌만 남고 통증이 거의 사라졌습니다. 정말 감사합니다. 이영상의 차별점은 영상을 보지 않고 목소리만 들어도 충분히 동작을 따라할 수 있고 중간에 광고가 없어서 누웠다가 다시 일어나서 광고를 스킵해야하는 번거로움이 없는 점이 영상을 끝까지 따라할 수 있는 원동력이 되었네요. 내일도 따라하러 올게요!,1년 전
202,  @user-gx5wv2xw3i,"저 진짜 약골이었나봐요.... 이거 하루 따라하고 등 허리 근육통을 얻었습니다,,,^ㅁㅠ꾸준히 해볼게요....",2년 전
203,  @user-zd1lb7ec8k,2021.5.3. 오늘 수련 잘 마쳤습니다. 감사합니다.,1년 전
204,  @user-eq6oi5nx7b,요가소년님! 오늘도감사합니다,1년 전
205,  @hsh3843,꼭 필요한 운동을 골고루 잘 올려주시니 감사합니다ㆍ오늘도 어제보다 조금 더 건강해진 느낌입니다ㆍ참 요가 수련은 매일 하는 것이 좋은지 아님 격일로 해야 좋은 지 궁금합니다ㆍ수련시간이 길지 않아 매일 하고 있거든요ㆍ,4년 전
206,  @user-mm7kg8my5q,처음 동작들 할 때 허리가 전체적으로 바닥에 꼭 붙어 있어야 하나요? 코어 힘이 부족하다보니 자꾸 바닥에서 떼지는데 허리에 좋지 않을까요? ㅠ,2년 전
207,  @user-bn8gj8fi2q,평범한 직장인입니다. 허리 통증이 너무 심해서 허리 요가 검색했다가 들어오게 되어 해보았습니다. 정말 시원한데 초반 동작들이 제가 코어 힘이 너무 약하다보니 따라하는데 너무 힘들어서 비명 지르면서 했습니다. 뒤에 추천 영상으로 30일 챌린지 있는데 그거 해보려구요. 감사합니다.,1년 전
208,  @sehwikim508,허리디스크인데 이거만 하면 허리가 풀려서 매일 합니다 감사해요 ㅠㅠ,3년 전
209,  @user-zs7yv7zo9o,저도허리가아픈데  하루도빠짐없이따라합니다  허리가안좋을때 하고나면부드러워진것같고 좀괜찮아져서 마니 좋아진것같습니다 감사합니다~^^,2년 전
210,  @user-bi7cn2xz1r,5월  챌린지 시작입니다. 첫번째 수련은 한시간이라 내일하고 2번 먼저 합니다Day79  5/4 월 하고 나니 허리가 시원해요,2년 전(수정됨)
211,  @eazyfitness3191,오늘도 수업후에 요소님의 목소리가 이끄는데로 ^^마치 요가수업을 듣듯이 편안하게안내하는데로 몸을 맡겼어요나마스떼 감사한맘을 이 한마디로 밖에^^,1년 전
212,  @sunigong2278,너무 맘에 드는  시간이었어요내일도 한번 더 해볼려구요~~,1년 전
213,  @aenoc76,오늘꺼 힘들긴 했지만 좋았습니다늘 감사합니다.,3년 전
214,  @user-ys3xj9cu2x,2020.5.2 수련완료다들 주말잘보내세요.,2년 전
215,  @user-eq6oi5nx7b,요가쌤 오늘도 감사합니다,1년 전
216,  @user-ru9ur5cb8l,9분 45초 팔다리를 모두 뻗는 동작이 쉽지 않네요. 허리디스크가 있는데 아무리 배에 힘을 줘도 무리가 갈 것 같아 마지막 횟수는 못 채웠습니다. 좋은 영상 감사합니다. 개운하게 잠자리에 들 거 같습니다.,4년 전
217,  @user-rn1gf1qz4v,영상수련.너무도움되네요 부지런히많이해보겟읍니다.고맙습니다.,3년 전
218,  @movielier93,너무좋아요….,1년 전
219,  @user-jy1mv4jz7m,감사합니다 ~^^,3년 전
220,  @user-kc8qh8zo1z,"안녕하세요! 요새 요가소년님 영상들 너무너무 잘 보고있습니다. 코브라 동작할때 허리가 조금 찝히는 느낌이 있는데, 무릎을 살짝 밖으로 돌리면 덜하더라구요, 무릎의 방향이 정면이 맞나요 바깥이 맞나요~?",2년 전
221,  @Jay57366,"오늘도 감사합니다.질문이요! 누운 테이블 자세에서 무릎 차례로 펴서 바닥으로 내릴때, 등허리부부은 계속 살짝 띄우나요?",1년 전
222,  @user-qp5lw6lw1f,"허벅지, 종아리 햄스트링이  짧고 무릎이 아픈 경우에도 따라해도 될까요?",1년 전
223,  @user-rq9zd3jm5h,오늘 물리치료 받고와서 한번 따라했는데 거짓말처럼 시원해졌어요. 계속 해보려고 구독 눌렀습니다!,2년 전
224,  @jeanlee28,"선생님, 오늘도 저에게 현재 절실히 필요한 허리 통중 완화 수련을 올려주셔서 뭐라 감사의 말씀을 드려야할 지 모르겠습니다. ㅠ. ㅠ이삼일 전에 결린 허리 통증때문에 며칠동안 부자연스런 자세로 있다보니 등 전체가 긴장되어 괴로운 상황이었는데 전에 선생님이 올려놓으신  요통 완화 동작들과 오늘 또 새롭게 올려주신 영상을 따라하며 큰 도움 받고 있습니다. 수련의 처음 부분을 따라할 때와 비교했을때 점차로 통증 부위가 부드러워지는 것을 느꼈습니다. 부상이 없을때도 꾸준히 따라하겠습니다.너무나 감사드립니다. 평온한 Hump day 보내세요 선생님!!!",4년 전
225,  @user-ni3wn7ub5r,요가소년님 너무 좋은요가영상들 감사드려요~ 제가 오랫동안 계속 앉아있어서 그런지 허리 기립근이 부드럽지가않다고해야되나 유연하지가않다해야되나 앉아서 두다리를 앞으로 쭉벋고 앉는자세라던지 다리를 양옆으로 넓게 벌려서 앉은다음 상체를 앞으로 굽히는 자세같은거 할때 영상에서는 상체를 쭉 피고 진행하라고 하시는데 피기가 힘들고 기립군이 굽어있는거같아요 ㅠㅠㅠ 혹시 기립근유연성이라던지 부드럽게 만들어줄수있는요가같은게있으면 영상올려주시면 감사드리겠습니다~~요가영상 너무 좋아요!!!!,4년 전
226,  @jiwonhong4273,"와, 척추 신경이 요근래 너무 아팠는데 덜렁거린다고해야하나ㅋㅋ 이거보고 중간쯤 따라하니까 안아파졌어요..;감사합니다! 나마스떼",2년 전(수정됨)
227,  @user-co1qt7sz5t,너무 너무 너무 감사합니다,9개월 전
228,  @nicemin,"21.2.20나마스떼 찌뿌둥한 등허리가 쫘악 펴지는 느낌이 들었어요 아주 시원합니다ㅎ 특히 코어에 힘이 들어가는 느낌이 좋았어요. 궁금한 것이 있는데요️(다리 골반너비 무릎 굽힌 상태, 좌우 발목을 향해 바닥으로 내려주는 자세에서) ""이제 호흡을 반대로 해봅니다"" 라고 하셨는데 그 부분 따로 이유가 있으신건가용?",1년 전
229,  @user-eq6oi5nx7b,요가소년님!감사합니다좋아요 누르고갑니다,1년 전
230,  @chloessweethome7914,안녕하세요. 항상 좋은 영상 자세한 설명 감사드립니다.이시퀀스를 두번째 수련했는데요. 오른팔 내리고 왼다리 내리는 교차 동작 (영상 8분쯤) 마지막 쯤에서 고관절 (hip flexor)부분 버티기가 힘들만큼 통증? 이 있는데 코어근육이 약한건지 hip frexor부분이 약해서 그런건건지 궁금합니다. 감사합니다. 좋은하루 되세요!,3년 전
231,  @user-fc8ns2xv3d,예방동작 맞나요??! 치료가 되는 느낌인데ㅎㅎㅎ 최근에 축구하다가 삐끗해서 계속 이러지도 저러지도 못하고 불편했는데 이 영상을 따라하니까 한결 가벼워졌네요!!감사합니다아!그런데 혹시 허리에 약간 통증이 오거나 뚜둑거리는 소리가 나는건 제가 무리해서 그런건가요??!,4년 전
232,  @user-eq6oi5nx7b,소년님!최고  감사합니다,1년 전
233,  @user-iv6ki1bm7g,마법같아요...내 허리 골반쪽 시원해졌습니다 ,1년 전
234,  @user-lx3gw1og9h,감사합니다~~^^,1년 전
235,  @user-rp5tp2mt6n,진짜.. 감사해요 전 지금 독일에 살면서 어제 bws-blockierung 이라는 진단과 진동제 몇알만 처방 받곤 3일째 등이 아파서 정말 죽을꺼 같았는데 ..ㅠㅠ 이거 하고 완전 시원해요!! 너무 신기하고 감사해요!!!,1년 전
236,  @user-zc1pk8sd4g,좋은 영상 감사합니다,3년 전
237,  @user-je3ph5yz1q,저두 갑자기 디스크증상이 심하고 걷지못하다가 허리시술받고 조심히 움직여보았습니다 개운하내요 ^^,6개월 전
238,  @ejpark318,2020.8.29오늘은 눈 뜨자마자 강아지산책을 먼저 갔다와서 수련합니다.터덜터덜 걸었더니 또 허리가 아파서 큰일났다 싶었는데 오자마자 바로 수련하고나니 아무렇지도 않네요.허리아플때 종종 찾아와야겠어요.오늘도 변함없이 엥나입니다!,2년 전
239,  @user-fq2ki6yh1b,"실시간 스트리밍.. 새벽기상이 힘든 제게 참 많이 도움이 되었는데... ㅋㅋㅋ 결국 오늘 제 욕심이 사단을 냈네요 ㅎㅎㅎㅎ 매트에 누워 한 시간을 고민하다가.. 실시간 좋아요 누르고, 전 이것에 머무는 걸로 마음을 굳혔어요. 회복되면,, 따라가는 걸로.. 핫!! 너무 슬픈데요? 핫핫핫....",2년 전
240,  @76ersphila7,오늘도감사합니다^^,2년 전
241,  @user-bm8gp1wy8s,마음에 드는 영상이라 이틀 연속 수련했어요.나마스떼,1년 전
242,  @user-mx6xo9jd3j,감사합니다^^,3년 전
243,  @sojengchoi33,초반 약 십분까지 하는 동작은 모두 허리 살짝 띄운 상태로 하는 건가요?? 아니면 등허리는 바닥에 붙이고 복근에만 살짝 힘 줘야할까요..?,2년 전
244,  @user-vn5xm2vh2v,허리통증이 많이 사라졌어요 감사합니다,1년 전
245,  @user-se7zy4wd3t,초반부는 코어 강화 영상을 잘못 틀었나 싶었어요ㅋㅋ 마지막엔 정말 잠들뻔 했네요. 오늘도 감사합니다,2년 전
246,  @user-zw7sf7br3k,허리에 통증이 있어서 수련시 허리를 꽉잡고 있는 느낌과 긴장으로 아사나할때마다 긴장과 신경이 쓰였었습니다시퀸스가 끝나고 나니  허리주변이 부드럽고  편안해졌습니다감사합니다허리에서 해방되는 그날까지 1일1수련 꾸준히 해보렵니다 감사합니다,1년 전
247,  @user-sc9kk2no2b,마지막에 휴식 너무 좋아요,4년 전
248,  @user-tm7nd3mo8k,마지막 휴식시간에 졸다가 내 코고는 소리에 깼습니다. 좋은 영상 감사합니다,3년 전
249,  @user-wg4cd8of8m,너무좋아요^^ 매일매일합니다,1년 전
250,  @user-ri6qx6qq5s,너무나도 자세히설 명도 잘 해주니까  나이가많은나도 딸어할수 있으니감사합니다,1년 전
251,  @soojinlee7974,"요통이 너무 심해서 이것저것 시도해보고있는데, 이 영상 하고나니 진짜 신기하게 허리가 훨 가뿐하고 통증이 완화되었어요..! 궁금한게 있는데, 누워서 나비자세를 하면 골반이 안좋은건지 아파서 하기가 힘듭니다ㅠ 대체할 자세가 있을지요? 그리고 전신요가 하고나면 오히려 허리가 훨씬 아파올 때가 있는데 허리를 자극하지 않으려면 어떤 동작들을 자제해야하는지 궁금합니다ㅠㅠ",1년 전
252,  @user-mm4bp9jr9r,감사합니다 요가소년님,2년 전
253,  @user-yo8yr4ov9d,저는 70세 여성입니다 영상 처음 접하고 따라하는데 너무 좋았습니다 매일 할거구요 좋아요 구독 알ㅇ립까지 올 렸습니다 좋은시간이었답니다 감사합니다,1년 전
