,아이디,댓글 내용,댓글 시간
254,  @user-qb5un9iu7e,요가소년님 한달전  케이블 티브이에서 소년님 영상 보고 유투브에서 찾아서 오늘 처음 따라해보아요 오늘 휴대폰으로해서 제대로 보지는 못하고 음성 들으면서 중간중간 영상 확인하면서 따라 해봤는데 정말 유익하네요 ☆이제부터 매일 매일 해볼까 하는데요 문의 드리는건 저같은 초보자는 잘 모르는게 많기에 초보자용 코스또는 해설이나 동작등을 좀 더 자세히 포커싱해서 알려주시는 부분이 있으면 좋을꺼 같은데 바쁘셔서 힘드시겠죠? 요가소년님 방송보고 태블릿을 살까도 고민중입니다 아무튼 존재해주셔서 감사하구요 초보자 카테고리가 있다면 보고 굳은 몸이 열심히 따라해볼께요 그럼 행복하세용 ^^,2년 전(수정됨)
255,  @geastie,200619 허리뿐 아니라 편안하게 복근운동까지 한 느낌이에요. 기분 참 좋습니다^^,2년 전
256,  @nyk2101,아 좋네요!! 매일 할려고요.,2년 전
257,  @user-rb1fs8rs3s,고맙습니다  열심히 따라 했어요 좋은영상입니다  다음 또  기다리겠어요,10개월 전
258,  @user-ie2dv7hu6d,계속 앉아만 있어서 요통이 생겼어요그래서 이 수련을 하게 되었는데 허리가 단단해지는? 느낌이에요!항상 영상 감사합니다나마스떼,3년 전
259,  @jjjy0416,골반이 찝히는 듯한 느낌이 드는데 그만큼 약하고 틀어져서 그런거겠죠? 오른쪽이 너무 떠있는 느낌이 있어요 ㅠㅠ 계속하다보면 괜찮을까요?,3년 전
260,  @user-if6sv7cg8o,요가소년님의 요가 영상을 매일 보고있습니다 :) 이 영상을 보면서 궁금한게 생겨서 댓글을 남겨요. 저는 무릎굽힌채 다리를 올리는 것을 반복하면 허리보다 허벅지 앞쪽이 많이 힘들어요 (4분 20초~9분 30초) 왜 그런걸까요? 원래는 척추에 자극이 가야하는 거죠? 편하실때 답변주시면 감사하겠습니당 ㅎㅎ,3년 전
261,  @user-jp3be6ki1x,"와 처음따라햇는데 너무 힘드네요ㅠㅠ 오늘부터 꾸준히 해보겠습니다. 다만 궁금한게 허리를 바닥에 붙이라는말 안하셨을때는 조금 바닥에서 허리를 띄워서 해도 되나요?? 하면서 몇동작은 잘못하고있는지 허리가 아파서요,,ㅠㅠ",2년 전
262,  @user-ki9nw9yn5u,안녕하세요! 코어근육을 기르기 위해 시작했습니다팔다리 뻗는 동작에서 오른쪽 허벅지 앞옆쪽이 시리다고 할까요 아리다고 할까요ㅠㅠ 코어근육이 부족해서 다리에 힘이 들어가기 때문일까요??ㅠㅠ,1년 전
263,  @user-im1hv3zy7j,2020.08.29 오늘 사바아사나에서 이완을 만났어요 덕분에 주말 아침도 편하게 시작해요. 나마스떼,2년 전
264,  @user-yg2vp4xy6m,요가 소년  선생님감사 합니다  저는나이가좀 많은 할머니입니다 허리가 많이아픈데 요가소년  푸로요가를 아침저녁  하고나면 한결 편안 합니다.감사 하고수고하심니다.,1년 전
265,  @eazyfitness3191,2021년 2월 20일^^오늘은 토요일오전수업가기전에 수련했어요가뜬해지는 느낌^^ 사바아사나에서 ㅎㅎㅎ 또 살짝 먼 곳으로 잠시 ...오늘도 나마스떼,1년 전
266,  @user-so8cn2of9x,정말 시원해요ㅎㅎ 내일도 해야지 새벽도하구,2년 전
267,  @user-gu9xq9um2v,감사합니다좋은영상보내주셔서늘즐거운날되시길바랍니다,2년 전
268,  @annevancent,"와 생리중 허리통증이 심해서 찾아서 했는데, 하고 나니 통증이 부드럽게 흩어진 기분이에요. 마치 허리 혼자 짐을 지고 있다가, 온 몸으로 짐을 나눠서 지는 느낌? 요가소년님 감사합니다 나마스떼",8개월 전
269,  @user-kr3bk9uk8o,허리가 강화된것같은 느낌이 들어서 좋아요 꾹,3년 전
270,  @user-zq6dm2wf3o,오늘도 너무 행복했습니다. 감사합니다 나마스떼,1년 전
271,  @user-wi5it4sb4q,안녕하세요 영상보며 늘 감사하게 수련 중입니다.. 제가 좌골신경통 허리방사통으로 주사도 많이 맞고 해서 이제 요가 수련을 조심히하고 있는데요.. 수련을 다 하고 나서 일어서면 갑자기 극심한(?) 방사통을 허벅지 근처에서 느낌니다.. 그러다 앉거나 누워있으면 조금 나은데요.. 이런경우 수련을 몇일 중단할까요? 아니면 수련중엔 큰 무리가 없으면 계속 수련해볼까요? 너무 답답하고 절박해서 질문드립니다 ㅠ,2년 전(수정됨)
272,  @user-wl4tq5hn4q,얼마나 풀릴까 했는데 앉았다 일어나는데 통증이 없네요..마법입니다....ㅠㅜ 진즉 할것을....3일내내 고생했네요...감사합니다.,1년 전
273,  @kimgomdori1716,허리가 아파 시작했어요. 중간중간 곡소리 나지만  하고나면 너무 시원합니다. 처음으로 구독이라는걸 해보네요. 감사합니다.,3년 전
274,  @maygim2390,21.5.4 미루다 하루지나서 완료.감사합니다^^,1년 전
275,  @user-nf7bg7vw1t,안녕하세요! 부드럽고 차분한 목소리로 잘 알려주셔서 요즘 요가소년님 보며 계속 따라하고 있어요 !근데제가 양쪽 팔을 올리고 자는 버릇이 있는데 이게 쌓여서 어깨가 무리왔는지 요즘 계속 어깨를 돌리면 뼈가 어긋나는 소리처럼 우드득 나요ㅠㅠ 근데 처음 양 팔을 위로 올렸다가 내렸다 하는 동작을 하는데도 어깨에서 소리가 나더라구요..ㅠㅠ이렇게 소리나면서 요가 동작을 하는 것도 어깨에 무리되는 동작인 걸까요?ㅠㅠ,3년 전(수정됨)
276,  @gyuhan87,마지막 명상 부분 노래가 뭔지 알수있을까요? 루틴 너무 좋아요,2년 전
277,  @user-bc9ho4zy3v,감사해요잘 따라하고 있습니다,2년 전
278,  @user-dm5pf6nc7z,요가소년님 영상이 좋아서 제가 필요한 척추측만증 관련 운동 요가소년님꺼 찾아보고 있는데 척추측만증에도 이 운동이 좋나용..?.?,2년 전
279,  @danielal4635,처음 해 봅니다. 효과가 있길 기대하며...,1년 전
280,  @user-vv4nn6ud8s,코어 근육이 부족해서 힘들었지만 시원합니다 감사합니다.,2년 전
281,  @chuchuchu7989,허리가 아파서 (경미한 허리 목 디스크 있습니다) 따라해봤는데요 다리를 내리고 팔 올리는 코어 강화 동작을 반복 할수록 이상하게 고관절이 뻐근한 느낌이 들어요. 계속 따라해도 될까요? 아 참 영상 감사합니다!,1년 전
282,  @user-eq6oi5nx7b,요가소년님!  오랫만에 인사드리네요 지금제가  요가한지 6가월이지나 됬네요 매일하루도 빠지지않고 계속햇더니 재발했던 척추관 협착증 없어졋어요  너무감사하고  고맙습니다~하루2타임하고있어요  이제회원이되고싶네요  요가소년님! 오늘도감사했어요  ~승승장구하세요♡♡,1년 전
283,  @user-gy9jc3bv1c,집에서 쉽게 요가를 할 수 있어 너무 감사합니다. 덕분에 몸이 가뿐하고 아침이 상쾌합니다. 거듭 감사드립니다.   무릎과 발목  허리가 아픈데 모두를 강화 할 수 있는 요가 동작으로  30분 정도 따라 하고 싶어요. 어느 프로그램이 좋을까요?,2년 전
284,  @amitola7364,감사합니다.,1년 전
285,  @dragonrainpark8747,오른쪽으로 내리 뻗던 신경통이 많이 가셨어요. 굿굿 나마스테!!,1년 전
286,  @user-qt1jl3kv6f,아래분 말이 딱 맞네요~ 파스 붙인것 마냥 시원하네요~감사합니다 ^^,1년 전
287,  @sokimm4567,감사합니다.,2년 전
288,  @user-vu1ij7tt6t,도와주세요~^^요가소년님의 영상을 몇가지 따라해 봤는데 제게 맞는 요가를 하고 싶어요 전 퇴행성디스크 환자입니다ㅠ 하다보면 허리가 아파와서 어떤 영상을 따라해야하는지 궁금합니다 무릎에도 무리가 안가고 허리근육과 배 근육을 키워 허리통증을 줄여보고 싶은데 좋은 영상 추천요~^^*,1년 전
289,  @chloefin2131,새벽수련으로 084+088했어요 좋은 하루되세요:) 나마스떼,2년 전
290,  @user-eq6oi5nx7b,요가쌤! 오늘도감사합니다  라마스떼!,1년 전
291,  @isadoraj5166,좋은영상 항상 감사한마음으로 함께 합니다. 허리디스크가 있는 경우 선생님의 영상 중 따라해도 좋을만한 영상  30분이상 되는것들  몆가지 추천해 주실수 있는지요?,4년 전
292,  @user-yk6tp4fp6j,안냥하세요?  요가소년님.전방전위증이 있어 열흘 전부터 매일 영상을 따라 하고 있습니다.   아직 큰 변화는 느껴지지 않지만  잘 맞는다는 느낌이 있어 계속 하려고 합니다.   전방전위증에도 도움이 될지요?,1년 전
293,  @user-cp1ek3to4p,요즘 다시 요가를 시작하게 되었는데 척추 요가 동작 중에 다리랑 팔 내리는 동작할때 왼쪽 엉덩이 윗부분(허리 아랫부분)통증이  심하게 오는데 그동작을 하지 않는게 나을까요? 평상시도 앉아있으면 왼쪽 엉덩이 윗부분이 아프기는 하거든요,3년 전
294,  @user-hi9qn4hv8i,2번째 약속 완료! 좋아요~~,2년 전
295,  @user-jb2vq5so3r,감사합니다. 프로그램 너무 좋아서 도움이 많이 됩니다.나마스떼. (),4년 전
296,  @jk4864by,선생님 오늘도.감사합니나 ,2년 전
297,  @-_-4547,감사합니다.,1년 전
298,  @nataliak0216,"오랜 시간 앉아서 보내는지라 허리가 많이 불편했는데, 이 영상 따라하면서 많이 편안해졌어요. 그런데 중간에 호흡의 순서를 바꾸어서 하는 것은 어떤 의미인지 궁금합니다.",2년 전
299,  @norangjoa,두번째 했어요~! 지난 번 보다 쉽네요. 으흐흐. 허리 시원~,1년 전
300,  @nahyunkim9323,오늘은 척추를 위한 수련으로 하루 시작합니다. 나마스떼,2년 전
301,  @user-mz6sr1ut1k,영상 너무 감사히 잘보고 있습니다. 30일 첼린지를 따라잡기위해 하루에 2일차씩 묶어서 하고 있습니다. 그래도 되죠?  점점 몸이 편해짐과 유연함을 느낄수가 있어 너무 좋네요. 근데 수련후 다리 떨림이 있는데.. 하체가 약해서 그런가요?,2년 전
302,  @a01022214854,팔과 다리 교체하면서 내릴때 양쪽 골반이 너무 아픈데 정상인가요?ㅠㅠㅠ,1년 전
303,  @murvoa,등을 대고 테이블포즈해서 손 위아래로 올렸다 내렸다 하는 동작을 할때 등허리가 바닥에 붙도록 노력해야하나요? 아니면 등허리와 바닥사이에 아치형으로 틈새를 벌리나요? 자세 수련 횟수가 늘수록 치골? 장요근쪽 통증이 생깁니다,2년 전
304,  @user-ws2jl5qv1v,오늘도 고맙습니다. 나마스테!!몸이 나름나른 ㅎㅎ,3개월 전
305,  @user-ko2nq6ct3v,셈 자세 보니들숨과 날숨만으로도 척추가 엄청나게 늘었다 줄었다 하는군요~*,4년 전
306,  @user-pl4ww9yh4t,허리가 좋지않을때는 꼭해야겠어요 꾸준히가 안되네요  감사합니다^~~,5개월 전
307,  @user-dk1uw1vn7b,처음에 편안히 누운상태에서 무릎을 구부리고 숨뱉으며 허리가 바닥에 내려갈때 통증이 심합니다 ㅠㅠ평소 허리가 좋지 않은 편이긴한데 이 자세 할 때 조금만 내려도 될까요?,2년 전
308,  @mold.2053,허리아파 오늘 해봤는데 좋습니다!감사합니다.,2년 전
309,  @yoonkim9754,"목소리도 넘 편안하구, 내가 찾던 스승을 찾은 느낌입니다. 온몸이 넘나 뻣뻣한 40대 중반 아저씨인데요. 저도 삭발 머리라서 애들이 요가소년님보고 아빠인줄 알았다하더군요.실은, 전 허리가 안 좋습니다. 일년에 서너번은 갑자기 주저앉아 못 움직이게 돼서 화장실도 못 가게 될 정도로 허리가 안 좋습니다. (의사샘께선 디스크보다 근육이 더 문제라고 하시구요)근데, 요가소년님 따라하면서 온 몸의 근육이 긴 겨울잠에서 깨어나고 싶어하는 요즘이라고 느껴져요.요가할때 몸 이곳 저곳에서 계속 담이 걸려서 종종 중단을 하게됩니다.저같은 사람이 추천받을 수 있는 코스가 혹시 있을까요? ㅎ항상 고맙습니다. *100000^------^",2년 전(수정됨)
310,  @user-jg4gv5rg6v,8:45 여기 부분에서 허리 윗부분은 매트에 붙이고 허리 중간부터 꼬리뼈 까지의 부분은 매트에서 띄워야 되나요??,1년 전
311,  @JJLIM9414,안녕하세요 선생님 덕분에 하루하루 열심히 운동하고있습니다:)  그런데 이시퀀스에서 다리위아래로 올리는동작을할때 골반이 많이 뻐근한데 제 자세가잘못돼서 그런걸까요?,1년 전
312,  @minjisong4478,"다리를 대각선으로 뻗고 손을 드는 동작에서 허리통증이 느껴지는데, 코어 힘이 없어서 허리를 쓰기때문인가요? 이런경우에도 계속 동작을 해도 괜찮을까요?",3년 전
313,  @user-mh1ol7jb2v,허리디스크가 있는데 활동량이 적어지면 허리 통증이 오네요.허리 통증 있을 때도 이 영상 운동 해도 되나요?코어 근육이 약해서 허리에 무리가 되는지 궁금합니다.,2년 전
314,  @user-pt9pr8xz2f,개운하게 완료!,2개월 전
315,  @user-dz5pv5ip6g,혹시 이 요가가 척추측만증에도 도움이 될까요?,2년 전
316,  @shinlee0112,"선생님, 늘 수련 감사히 진행하고있습니다. 그런데 최근 허리가 안좋아서 관련된 영상들 통해 수련중인데 유독 이 시퀀스를 마치고 앉으면 머리가 띵~하면서 1분정도 너무 아파요..다른 시퀀스는 다 괜찮은데 이것만 그래서..제가 어떤 동작을 잘못하고 있는건지..이유가 있을까요? ㅠㅠ흑",1년 전(수정됨)
317,  @user-xr3pe3yv2w,오늘도 감사했읍니다.,4년 전
318,  @sojeongjun5865,내가 기억하기 위한 코멘트 : 편한 마음으로 시작햇다가 코어 단련하기 좋은 시퀀스,1년 전
319,  @user-zs7yv7zo9o,이거는꼭따라합니다 마니좋아요 감사합니다,2년 전
320,  @user-yp3pu5dq8v,병원에거 척주가 휘었다고 하여 영상을 찾아보던 중 이 영상을 발견하게 되었습니다! 이 영상이 척추교정하는 데에도 도움에 될까요?,2년 전
321,  @hongyoungjang4269,"8월 29일 #8월설렘, 오늘도 감사합니다! 요새 실시간 못들어서 소식 궁금했는데 9월 테마는 뭘까 궁금하네요 ㅎㅎ",2년 전
322,  @ejpark318,2022.6.21허리가 가볍습니다!엥나엥나!,5개월 전
323,  @october2122,목이아파서 어제부터 하고있어요어제보다 오늘이 훨씬부드럽네요저는허리 근육이  약해서인지한번도 상체를 앞으로 일으켜한번 일버난적이없어요요가학원 다닐때도  저만 그러더라고요오늘 영상 잘봤습니다건행 ㅎ,1년 전
324,  @korrk8083,2일차 완료 댓글납깁니다 감사합니다 요가소년님,2년 전
325,  @user-qt1wz2fu7i,2월 챌린지 스무번째 감사합니다,1년 전
326,  @user-nr7ih5vb7x,"제가 꼬리뼈를 다친적이 있어서 누워서 하는 동작중에 9:13초에 진행하는거는 꼬리뼈가 아파서 하기 힘들 더라구요. 이런 경우, 그 동작은 안하고 넘어가도 되는건지, 아니면 꼬리뼈가 아파도 참고 해야 하는건지 궁금합니다.",2년 전(수정됨)
327,  @dongminchoiadriand7189,"210503_5월의 첫 월요일, 가벼운 몸과 마음으로 시작합니다. 고맙습니다. 나마스떼~",1년 전
328,  @jongmoonpark5273,4:45 동작처럼 왼쪽다리 바닥으로 내릴려고 하면 와이존경계부에서 뚝하며 뼈가 맞춰지듯 계속 충돌현상이 있는데...아무래도 불균형으로인한 증상 같은데 안아픈 범위에서 본 동작 계속 수행하면 좋아질까요 ? 괜찮겠죠? 그리고 영상 정말 좋습니다 구독 꾹!,2년 전(수정됨)
329,  @user-te9vj1sx3i,영상 감사해요!! 허리를 바닥에 붙이고 하눈데도 허리가 좀 불편한데 왜 이럴까요?ㅠ,3년 전(수정됨)
330,  @Sookrook,누워서 다리를 대각선으로 펴는 동작 시에 허리골반 중립상태면 허리가 바닥에서 떼어있는건가요?? 허리에 부담이 간다면 등허리를 바닥에 붙이는 것도 상관없을까요??,1년 전
331,  @choirin9399,코어 복부 허리 전반적으로 근육이 많이없는 학생입니다ㅠㅠ 테이블탑자세에서 팔다리를 왔다갔다하면 허리가 너무 아픈데 먼저 복근을 기르고 이동작을 해야하는걸까요..? 허리가 건강한편은아니지만 딱히 질환이있는건아니고 복근이없어서 허리에 힘이 더 실리는거같은데... 이동작 계속하는게나을까요..? 아니면 어떤운동을 먼저해야하나요ㅠㅠ,3년 전
332,  @preferable-1129,구라 안치고 파스 몇시간 붙이고 있는 것보다 이 영상 한번 따라 하면 훨씬 나아짐,2년 전
333,  @dafnerosa3812,"선생님 안녕하세요? 제가 골반이 많이 비틀어져있고, 허리는 꼬리뼈쪽 척추가 살짝 디스크끼(?)가 있다고 해서 요가를 따라하고있습니다. 그런데 누워서 다리를 들어 대각선으로 뻗는 동작에서 양 골반에서 뚝, 뚝, 하고 뼈가 걸리는 느낌과 소리가 크게 납니다. 그냥 무시하고 따라해도 괜찮까요? 툭툭 걸리긴 이물감이 있지만 그외에는 다리가 내려가긴하고 올라오긴 하거든요ㅠㅠ!",7개월 전
334,  @user-gn2lq6en9b,감사합니다,1년 전
335,  @user-te2is5kv2i,슨상님...초보에겐...  무쟈게 힘들구만요...^^;기초 수련 더 하고 올께용~~♡,2년 전
336,  @user-eq6oi5nx7b,요가소년! 감사합니다  일주일 정도 매일따라했습니다  저는 척추관 협착증 시술했는데  2년만에  재발해서 신경주사도 4번이상맞고  최근에는 침도맞고 추나도하고 추나선생님 권유로  척추운동을시작햇는데  우연히  며칠전요가소년을 알게되고~운동시작했는데   넘 좋아졌어요 ~말씀도귀에쏘옥 수련하기 너무좋아요~계속수련할려고요 전 젊어서 요가를 10년이상 했어요~요가소년!파이팅,1년 전
337,  @user-zh7mc5tz1i,허리가 요새 너무 아프고 안 그래도 측만증이 있어 요새 더 그런가 했어요 방금은 나갔다 왔는데 서있는데도 너무 척추랑 등허리가 아파서 바닥에 누워만 있어도 아팠는데 이 영상 한 번 따라했더니 안 아프네요 일어나면 아프긴 해도 자주 따라 해야겠어요 ㅠㅠ,1년 전
338,  @moonchild.5821,전 탑 테이블(?) 자세가 제일 힘드네요 다리가 부들부들 떨려요 ㅜㅜ 차라리 팔과 다리를 교차해서 왔다갔다 하는 동작은 괜찮은데 가만히 무릎을 굽히고 들고 있는게 엄청 힘드네요 그래도 다 하고 나니까 허리가 건강해지는 느낌!,3년 전
339,  @blickin,오늘도 감사했습니다,3년 전
340,  @CHOCOLATE8557,나마스떼... 오늘도 감사합니다️,2년 전
341,  @user-eq5gb3hv2m,오운완! 이만한 게 음따 진짜,1개월 전
342,  @user-eq6oi5nx7b,라마스데!요가쌤! 감사합니다,1년 전
343,  @user-qv8cg2rt5m,채현두현아빠~~~예요육아가 끝나고 큰애가 5학년......벌써 결혼생활 14년차네요~~~지친 몸 아내와 같이~~ 운동할 수 있는 프로그램 감사합니다.~~,3년 전
344,  @user-fn3er3wg4w,감사합니다,3년 전
345,  @jworld7434,요가스트랩으로 왼쪽다리 당길때 '사시나무 떨듯' 혹은 '겨울바람에 나뭇잎 흔들리듯' 라는 문구가 머리에 똭 ,1년 전(수정됨)
346,  @eunjulee6918,"누워서 나비자세를 할 때 다리에 힘을 풀어버리면 고관절쪽에 통증이 있어요. 다리를 좀 들면 통증이 느껴지지 않는데, 어떤 자세가 올바른 자세인가요~?",2년 전
347,  @user-fn3er3wg4w,감사합니다,3년 전
348,  @soyeonpark7582,"연달아2번했습니다,파스붙이는것보다효과있네요 한동안계속해보겠습니다 은인이십니다 ㅋㅋ",2년 전
349,  @user-fn3er3wg4w,감사합니다,3년 전
350,  @user-wg7zu7wg6x,요새 요가를 한번 시도해보려고하는데요 제가 척추가 매우 안좋은데 소화불량도 있어서요 혹시 소화불량 관련된 요가 혹은 딴 요가 자세랑 척추요가랑 병행해도 되나요?,2년 전(수정됨)
351,  @lovelyzoo4401,20.05.02 수련 마치고 갑니다. 나마스떼,2년 전
352,  @user-nn7wz9lm3g,허리가 뻐근해서 운동하고 갑니다,1년 전
353,  @blickin,온가족이 다 누워서 하다가큰딸 아웃........아내와 저만 끝까지 했네요감사합니다.,3년 전
354,  @user-jk6zb6tg6g,"선생님!교정때문에 시작했는데,오른다리 내리는 과정에서 오른다리만 고관절 뚝 소리가 나고 약간 땅김?아픔?있는거 같은데 그만해야할까요?",3년 전
355,  @yegyeongjo255,이 시퀀스는 허리통증 좌골신경통 예방차원에서 열심히 해야겠어요/같은 동작에서 들숨과 날숨을 바꿔서 해 주셔서 위로 받았습니다 어떤 동작에서는 지도 하시는 숨과 반대로가 더 편하기도 해요(저만 그렇겠지만) 이럴 때 들숨과 날숨을 바꾸면 안 될까요?/,4년 전
356,  @user-no2ty4uv6w,사바아사나 할 때 간질간질한 하체 느낌이 개운하네요.,1개월 전
357,  @user-dz4lz7ih3s,예전에 척추 디스크와 경추디스크진단을 받았는데  나름대로 운동을 꾸준히 한결과 현재 디스크 둘출(엑스레이영상)은 보이지않고  통증도 많이 줄어든상태입니다그런데  궁금한점은  누워서 다리 수직에서 아래로 내렸다 올리는 동작을 하면  허리뒤편에서  뚜둑뚜둑하는 소리가 납니다바르게 몸을 정렬하는 동작에서도  허리쪽에서  소리가 나는데 왜그런지 궁금합니다.,2년 전
358,  @user-pm2jo7ky4q,감사합니다,1년 전
359,  @user-lh9od9cp4g,금요일 가뿐히 수련 완료했습니다!나마스떼,2년 전
360,  @loveing1810,은근히 힘든 시퀀스였습니다 :),2년 전
361,  @user-eq6oi5nx7b,라마스데 오늘도감사합니다 요가소년님!,1년 전
362,  @chaeeunkim4740,"제가 요가 한 지 3년이 되어가는데요. 저번달에 전갈자세로 넘어가다가 반다가 풀어져버려서 그대로 넘어져서 허리를 요추 부근을 책상 박았어요 ㅠㅠ 그래서 잠깐 요가 올 스탑하고 정형외과에서 도수치료랑 충격파 받고 있는데 아무래도 요가를 매일 하던 몸이라 몸이 근질근질해서 선생님 영상 찾아왔는데 역시 요가로 풀어줘야하는거 같아요 ㅜㅜ 역시 최고,,, ㅜㅜ",2년 전
363,  @z-6572,"6주전쯤에 갑자기 허리디스크가 찢어지는바람에 걷지도 못하고 난리였어요ㅠ약물치료했는데 일은 해야하고, 그때부터 2주후 많이 걸어야하는 출장도 잡혀있고 마음이 엄청급해서 물리치료사님들 영상 찾다가혹시몰라 요가소년님꺼 찾았는데대부분 물리치료사님들이 알려준 운동으로30분 허리운동이 딱!!!!이걸로 한달째 아침마다 하는데안한날, 한날 확연히 다르구요급속도로 허리 회복했습니당ㅎㅎ덤으로 뱃살까지 빠져버렸네요ㅎㅎㅎ너무나 감사해요 요가소년님",5개월 전
364,  @user-sl8ru2ee1b,목소리 너무 좋아요,4년 전
365,  @dragonrainpark8747,매월 1짜 들어가는 날에 해요. 굿이에요. 나마스테!!!,1년 전
366,  @blickin,오늘은 저만 했네요 오늘도 수고하셨구요~~~감사합니다.내일은 오늘보다 나은 자세로 할수 있도록 노력하겠습니다.,3년 전
367,  @user-ws2jl5qv1v,오늘도 고맙습니다. 나마스테!,5개월 전
368,  @user-ol1ci7dw8i,허리디스크가 좀 심한데 천천히 가벼운 동작만 따라해도 도움될까요??,1년 전
369,  @user-jf7ww7jv3e,선생님 제가 꼬리뼈가 많이 튀어나온 편이라 누워서 코어운동할때 많이 아픈데 그런 동작을 진행할수 있는 방법이 없을까요?,4년 전
370,  @user-bt6zo8uz6p,이렇게 부들부들 진동모드라니.. 거듭거듭 수련해야겠어요. 아아 감사한 마음으로 나마스떼,1년 전
371,  @oldsonglhs,,9개월 전
372,  @wonnie3044,"안녕하세요 베이직 요가, 모닝요가, 배드요가만 하다가 이번에 이 시퀀스로 해봤습니다. 제가 자전거사고로 몸의 왼쪽전체가 안좋다고 느끼긴 했는데 그래서 그런지 첫번째 자세 (양다리 90도로 들어 유지)할때 왼쪽다리가 의지와 상황없이 흔들리더라구요, 오늘 처음 해보았는데 하면서 점점 나아질까요? 갑자기 막 다리가 떨리니 문득 무서운 생각이 드는거에요 ㅠㅠ 답변 부탁드리겠습니다..",2년 전(수정됨)
373,  @leejan126,영상보고 자주 운동합니다.  감사해요. 혹시 허리디스크랑 협착 환자가 해되나요?,3년 전
374,  @user-hd2vb5fy1r,요가소년님 골반 전방경사를 교정 할 수 있는 요가가 있을까요?또한 골반 전방경사가 있을경우에 피해야 할 요가자세가 있을까요? 예를 들면 전굴자세 라던지,4년 전
