,아이디,댓글 내용,댓글 시간
148,  @user-ic8wj1lh7h,일반 둔한사람도 따라하기 너무 편해요 ^^가끔 되는 유연한 동작은 아내분 따라하공~♡너무 실질적으로 유용합니다~~일시적 허리통증으로 찾아봤는데유용할 듯 해서 구독하고 갑니다~♡,2년 전
149,  @user-gm5wj5tx3h,"땅끄부부님 안녕하세요 :) 어린 나이에 허리가 아파서 매일 동영상 보며 하고 있는 학생입니다ㅜㅜ 설명도 자세히 해주시고 자세 하나하나 잡아주시는 영상 올려주셔서 정말 감사합니다. 다만 매일 하다보니 생각보다 시간을 차지하는 게 많아서 혹시라도 가능하다면 설명과 말 없이 동작만 시간대로 딱딱 하는 시간이 단축된 영상도 찍어주신다면 더 좋을 것 같습니다! 매일하다보니 자세들도 외워지고, 다음 순서가 뭐일지 생각이 나는데 스킵을 계속 하자니 번거롭기도 하네요! (하시는 대사도 이제 외웠다구요ㅋㅋㅋ...)저의 개인적인 피드백입니다 항상 건강하세요️️",2년 전
150,  @ijak0187,"Ah you are so sweet together  And thanks for those useful videos, it really works well and I enjoy watching you two!",4년 전
151,  @user-ks4vw1rx4f,땅끄부부님 따라서 운동 시작한지 일주일째입니다허리가 않좋고 팔뚝살 빼려고 시작했는데 여러가지  운동을 따라하면서 함께 운동하니 너무 좋아요한달정도 하고나면 효렴이 보이겠죠나잇살 물러가라~~~홧팅♡♡♡,2년 전(수정됨)
152,  @user-hs8rl1ip8e,허리가 아프기도 하고 요즘 다시 생각이 나 매일은 아니지만 스트레칭 하며 덕을 보고 있습니다! 순서를 진작에 외워서 노래를 들으면서 하는 바람에 영상을 찾아오지 않는 것이 죄송스러워 댓글이라도 적어 봅니다 건강해질 수 있도록 도와주셔서 감사합니다 정말 짱끄부부,1년 전
153,  @user-zv5ks1xh8j,진짜 너무 시원해요오오 ㅠㅠㅠㅠㅠㅠ쵝오,2년 전
154,  @kkikiki3788,허리가 너무 아파서 오늘 일도 못했는데 반신반의 하면서 따라했더니 아까는 아팠던 자세가 지금은 하나도 안아프고 개운해요 !!!!!!!@!@! 너무 감사합니다,2년 전
155,  @cholpak6836,아정말 운동 되는데요.상당히 깊이있는 강의 네요.감사합니다,3년 전
156,  @user-vu3hc2dr1x,와...허리 아파서 따라했는데 좀 나아졌어요!!! 감사해여 ㅎㅎ,3년 전
157,  @Pineapple_Sherbet,자다가 허리가 너무 아파서 깼는데 영상보고 스트레칭 하니까 덜 아파졌어요..땅끄부부님 덕분입니다ㅜㅜ 앞으로 꾸준히 스트레칭 따라할게요 좋은 영상 올려주셔서 감사합니다,7개월 전
158,  @user-cy7sc8wl4d,허리디스크로 두 번 시술 받았고 지금은 홈트로 건강을 회복했어요~ 그래도 척추 건강 늘 신경쓰여 스트레칭 찾다가 땅끄부부님 영상으로 시작했습니다 ️2/14 ️2/9 ️2/8 ️,2년 전(수정됨)
159,  @user-pv7do6vu4w,안녕하세요^^오늘부터 영상보면서 운동하려고합니다.지금 2번연속하고 댓글 남기는데요ㅎ앞으로 꾸준히해서 허리통증 사라지길 기대해봅니다ㅎ감사합니다^^,2년 전
160,  @user-ci8vf1er7j,하고나니까 진짜 시원하고 좋아요 전 허리옆쪽부터 엉치가 가끔 땡겨서 걸을때아픈데 매일 해봐야겠요  허리스트레칭 있는줄 오늘알았구만요 감사합니더^^,2년 전
161,  @user-wq3pd9py1q,2/2교통사고로 인한 디스크 때문에 3개월을 요통에 시달렸는데.. 많이들 나아졌다는 후기 믿고! 또 땅끄부부를 믿어 오늘부터 시작합니다!!!다시 춤출 수 있으면 좋겠네요 ㅠㅠ일주일 뒤에 또 후기 남기겠습니다!,2년 전
162,  @egretr4084,허리디스크 때문에 허리부분을 단련하고 싶어서 고민이였는데 이런 핵꿀영상 올려주셔서 감사합니다!,4년 전
163,  @minjeongyang2762,오래 누워있더니 허리가 너무아파서 스트레칭 몇개찾아봣는데요ㅜ 플랭크자세에서 확 허리가 괜찮아졌어요! 꾸준히해볼게요 감사해요,1년 전
164,  @user-cb6hx5qu7k,와 허리 아팟는데 진짜 시원해요,2년 전
165,  @user-ts6dk8bg6y,참...들여다보고 만든 스트레칭처럼 왜 내가 아픈 자리마다 시원한건지...?어무니 모시고 매일 스트레칭 도전!^^!,2년 전
166,  @user-dp6pi8yc6d,최근 앉아서 하는 일로 인해 허리가 많이 아팠는데 아침 저녁으로 하루 두 번씩하니 통증이 없어졌어요 많은 분들이 이 영상을 보고 건강해지시면 좋겠어요 좋은 영상 감사합니다^^,2년 전
167,  @user-xl4bg8fx5w,좋은 스트레칭 가르쳐주셔서 감사합니다~^^,2년 전(수정됨)
168,  @soyoungkim5077,다이어트 때매 운동을 시작했는데 무릎이랑 허리가 자꾸 아파서 오늘은 땅크부부님 허리통증 완화 찾아서 시작했네요. 넘나 시원해졌어요. 앞으로 매일 해야겠어요. 살이 갑자기 많이 쪄서 무리가 안 되는 운동 위주로 홈트해야겠네요.,3년 전
169,  @hosikchae3911,"코로나바이러스 상황으로 재택근무 중인데, 평소랑 다른 상황에서 일을 해서 그런지 엊그제부터 허리가 아프더라구요. 한 번 다라하니까 싹 풀리네요! 감사합니다!",2년 전
170,  @_ddxik3383,안녕하세요 선생님!! 일 시작하고 허리통증이 너무 심해서 등운동과 함께 주3회 운동하기가 목표입니다:)01/05(1일):  진짜 너무 시원하고 누워서 플랭크 할땐 허리 단단해지는 느낌? 이 너무 좋았어요ㅠㅠ—————————————-01/19(1일): 운동 끝나고 마무리 스트레칭으로 하주면 너무 시원해요ㅠㅠ,10개월 전(수정됨)
171,  @user-pd2de7hi3x,허리디스크가 터져서 간단한 운동조차 할 수 없는 와중에 다이어트가 너무 하고싶옸는데이런 스트레칭이 있는줄 몰랐어요️️하루에 한 번씩 꼭 해줘야겠습니다너무 아팠는데 이렇게 코어운동이라고 해야할까요 이런 스트레칭 한 번 하고나면 그렇게 개운할 수 없어요너무 감사합니다️,3년 전
172,  @user-fb9ot5lb3s,"땅끄부부님 덕에 19년도는 건강하게 살았지만 20년,21년은 저에게 넘 소홀하고 살도 많이 쪘어요ㅠㅠ 붓기도 심해지고 최근에는 갑자기 허리 통증이 일주일간 지속되고 있는 와중에 이대론 안되겠다 싶어서 찾아보다가 땅끄부부님이 허리스트레칭도 올려주셨구나! 하고 냅다 따라해봤습니다 ㅋㅋ 앞으로도 계속 꾸준히 해야겠지만 한번 했다고 통증이 많이 줄었어요! ㅠㅠ 앉아있기도,누워있다가 일어나는것도 넘넘 힘들었는데 다시 운동 시작하고 허리 건강도 챙겨야겠습니다 매일매일 찾아오도록 열심히 할게요!",11개월 전
173,  @user-uf3ti1mv4t,다이어트 운동할려다 며칠전에 종아리 스트레칭 너무 시원해서 허리아파서 또 따라했거든요..와..몇년전에 땅끄부부 들었는데 그땐 글쿠나했는데 왜 유명한지알겠다..진짜최고다 빈말아니구 진짜대박,1년 전
174,  @user-xw3do8ob2h,동영상 보면서 운동 잘 따라하고있습니다. 효과도 좋은거 같구요^^ㅎㅎ다름이 아니라 혹시 골반교정법도 한번 콘텐츠로 다뤄주실 수 있나요? 뭔가 몸을 바로 잡아주고 싶은 욕구가 충만한데 제대로 된 방법을 잘 모르겠어요... 여러 자료들을 보니 현대인의 대부분이 조금씩 다 몸이 틀어져있다고 하더라구요 본인도 모르는사이에...꼭 한번 골반교정 주제로 컨텐츠 한번 다뤄주세요^^ 땅끄부부 파이팅!!!!♡♡,4년 전
175,  @juneee2611,허리 아파서 응급실 실려갔었던 디스크 고위험군 환자(?)입니다. 허리 좋아질 때까지 상태 체크하면서 하루에 한번씩 따라할게요 좋은 영상 감사합니다!!!9/7 ️ 아픔9/8 ️ 아픔9/9 ️ 아픔9/10 ️ 아픔9/119/129/139/149/159/169/179/189/199/20,2년 전(수정됨)
176,  @user-me6df9lt3v,"허리통증이 심했는데, 따라해서 해보니 통증이 많이 가라앉았어요!!! 꾸준히 해볼께요 ㅎㅎ 감사합니당ㅎㅎㅎ",2년 전
177,  @user-jj6ip5gq5d,척추측만증으로 만성허리통증 달고사는데 아침마다 따라하면서 통증극복중입니다... 쵝오네요..,2년 전
178,  @user-yh7nt1wi2f,8일차 ! 한달에 한번 찾아오는 날이라 컨디션너무 안좋았는데 많은도움 됐어요 !,2년 전
179,  @user-th5fm7le1f,선천적으로 허리가 안좋게 태어나서 항상 아픈데 치료도 받고 이제부터 이 스트레칭 할려고요 알려주셔서 감사합니다ㅠㅠㅠㅠㅠ4.27 ️4.28 ️4.29 ️5.12 ️5.13 ️5.14 ️5.15 ️5.16 ️5.17 ️5.18 ️5.19 ️5.20 ️5.21 ️5.22 ️5.23 ️5.24 ️5.25 ️5.26 ️5.27 ️5.28 ️5.29 ️5.30 ️5.31 ️6.1 ️6.2 ️6.3 ️6.4 ️6.5 ️6.6 ️6.7 ️6.8 ️6.9 ️6.10 ️6.11 ️6.12 ️6.13 ️6.14 ️6.15 ️6.16 ️6.17 ️6.18 ️6.19 ️6.20 ️6.21 ️6.22 ️6.23 ️6.24 ️6.25 ️6.26 ️6.27 ️6.28 ️6.29 ️6.30 ️7.1 ️7.2 ️7.3 ️7.4 ️,2년 전(수정됨)
180,  @user-sg2ye3yl7o,제가 허리가 안좋아서 매일 하고 있어용~~허리 운동 알게 해주셔서 감사해오~♡,3년 전
181,  @dal3210,헐.대박이요!앉아서 공부하다가 허리가 너무 아파서. 이영상을 보게 되었는데..방금 진짜 한번 했는데...솔찍히 할땐..아무느낌 없었는데...하고 나니깐....와..허리가 완젼 좋아진 느낌!!땅끄부부님!!너무너무 감사해요ㅠㅠㅠ,2년 전(수정됨)
182,  @user-jl1tq4tl8s,"진짜 미침,,, 정말 ,,,️ 너무 좋아요 하하애기 낳고 허리 너무 아팠는데 진짜 너무 시원해요 정말",1년 전
183,  @user-ge6fo8dt1u,와 이것저것 운동한다고 무리해서 허리가 아팠는데 거의다 풀리네요ㅜㅜ 넘나좋은것,3년 전
184,  @user-kv3jp7ph7y,일하다가  다쳐서  이영상보고  매일  최소3번이상 스트레칭합니다   이영상보고 스트레칭할때  다른영상보다  하기 편하고  하고나서 좋습니다  다른분들도  스트레칭  열심히 해주세여 ㅎㅎ,2년 전
185,  @zunyoo2527,저희 집 쇼파가 허리에 안좋은건지 계속 허리가 아프다가 이 스트레칭 해봤는데 허리가 편안해지고 좋네요!! 역시 믿고 따라하는 땅끄부부님들ㅜㅜ 감사합니다,2년 전
186,  @user-bl5nu6vs3p,저 허리가 너무 아파서 따라했는데 바로 통증이 많이 줄어들었습니다 너무너무 감사해요!!,3년 전
187,  @sweetjaeha33,오늘이 1일이에요ㅎㅎ추천해주셔서 잘 했어요! 친절한 설명 감사합니다♡,1년 전
188,  @user-dm5bc2uo3j,7:32 오드리님 너무 귀여워요ㅠㅠㅠㅠ이자세 넘 편안해서 동영상 끝나고도 계속 눈감고 그대로 하고 있었어요ㅠㅠㅋㅋㅋ 넘좋아요,2년 전
189,  @christinagrace5767,정말 쉽게 이완이 되고 도움이 많이 됐어요 감사합니다!^^,11개월 전
190,  @user-xj2bf6vj6u,요즘 시험기간이라 살이 자꾸 찌고 허리도 아픈데 가벼운 준비운동으로 시원함을 즐길 수 있네요!감사합니다,7개월 전
191,  @sooinnlee7982,허리 근육통으로 세달넘게 고통받고있는데 진짜 도움되네요 한의원가서 침맞은지도 몇주 됐는데 이 영상 제대로 따라하는게 훨씬 효과 좋아요,2년 전
192,  @user-ur8pp6os5i,13살에 허리가 끊어질것 같아서 이동작을 따라해봤는데 너무 좋아요 ㅠㅠㅠ,3년 전
193,  @user-gw3ro2sz4m,"이 스트레칭을 이제 알다니,, 너무 좋아요",1년 전
194,  @user-wt3kl7iw1w,목에 좋은 스트레칭도 소개 부탁드립니다영상 보면서 허리 스트레칭 매일 따라 하는데 정말 좋아요,2년 전
195,  @user-bh7fm4dd5e,땅끄 부부 말로만 많이 듣다가 허리가 아파서 첫번째로 찾게 되었어요! 오늘 처음 따라했는데 운동 지독히 싫어하는 저한테 무리 없이 잘 따라할수 있는 운동이었어요! 우선 이주동인 꾸준히 해볼게요ㅠㅠ,2년 전
196,  @yag-tv,좋은 교정 영상 잘 보고 앞으로도 꾸준히 보면서 관리하겠습니다!,7개월 전
197,  @user-vk4zd1bv3c,안녕하세요 항상 영상보며 운동 잘 하고있습니다 운동들이 하나같이 너무 좋은 것같아요! 이 운동에 대해 궁금한게 있는데 혹시 척추측만증에도 좋은 운동인가요?,2년 전
198,  @todayis7627,걷지도 못 할 정도로 너무 아파서 따라해봤는데 신세계예요...어제 저녁에하고 일어나서 아침에 했더니 하루종일 무리 없이 잘 생활했어요! 너무 감사드립니다ㅠㅠ 아침 저녁으로 꾸준히 해야겠어요ㅎ,3년 전
199,  @user-zb6kv1qy2x,"이거 효과가 진짜 좋네요..제가  잠을 잘 못 잤는지 허리가 진짜 욱신거리고 따갑다고 느낄 정도로 아파서 스트레칭을 해줘야겠다고 생각해서 한번해봤는데  저거 하고 하루 지나니깐 언제 아팠냐는듯 고통이 확 사라졌어요,, 진짜ㅋㅋㅋㅋ 이 고통이 일주일은 갈 것 같은 고통이였는데 하루만에 확 사라지니깐 너무 놀랍네요.. 그래서 어제부터 계속 꾸준히 하고 있어요!! 효과 만점입니다!",2년 전
200,  @skkim5709,오늘은 허리통증이 좀 있어서 운동을 쉴뻔 한 갈등이 있었지만 빠지지않고 하고자 강한운동은 못했지만 어제 땅끄부부님답글로 알려주신 이 스트레칭영상과 날하스 영상보며 허리에 좋은 운동으로 3일째도 빠지지않고 완료했어요^^다음주도 힘들다고 쉬지않고 꼭 운동하러올게요!,3년 전
201,  @user-us2sy4gg8b,요즘 허리에서 시작해서 엉덩이까지 통증이 있어서 고생하고 있었는데 꼭 따라해봐야겠네요ᆞ감사합니다~~^^,3년 전
202,  @user-kb5sc3dj8q,"저, 이 운동의 효과 이번 추석에 톡톡히 보았어요~  정말 땅끄부부님께 감사의 말씀을 꼭 전해드리고 싶고 운동이 필요한 사람이 있으면 땅끄부부님 채널을 꼭 꼭 추천해주려고 해요~ 저는 평소에 허리가 안좋아서 조금만 무리를 하면 허리 펴기가 힘들정도였네요. 이번 추석에도 어김없이 두세시간 앉아 전을 부쳤는데! 어머나 어머나~  이게 웬일이예요~ 허리가 안아파요~  어떻게 그런일이 가능한지 모르겠어요. 정말 땅끄부부님 너무너무 감사해요~^^  앞으로도 영상 보며 열심히 운동 따라 할거예요.저는 운동전후에 하는 스트레칭과 이 허리 좋인지는 스트레칭, 하체 날씬해지는 스트레칭을 했네요. 스트레칭 세가지만 했어요. 허리 안좋으신 분이라면 꼭 해보시길 추천드립니다. 분명히 효과는 보실거예요. 제가 장담합니다! ^^",2년 전
203,  @justkeepgoingit1712,올해도 보면서 하고 있습니다. 확실히 허리 근육 푸는데 도움이 됩니다.,10개월 전
204,  @user-vb2hr1rg6s,평소에 다리꼬는것과 같이 앉아있을때나 누워있을때 생활습관이 좋지 않아 가끔 허리통증을 느꼈는데 곧 괜찮아져서 아무 조치를 할 생각을 하지 않았는데 어제 또 통증이와서 스트레칭을 한번 해보자 해서 했는데 바로 통증이 사라졌어요 !! 완전 신기해서 오늘도 했습니당 감사합니다,2년 전
205,  @user-gh9eh1xq5e,고3 입시미술하는 사람인데...ㅠㅠ 이 영상 정말 도움되는 것 같아요 허리가 너무 아픈데 도수치료 받기엔 시간이 너무 깨져서 어떻게 하지 하다가 영상 보고 따라하고 있어요..감사합니당...,3년 전
206,  @user-di6fk1qd4r,와 진짜  효과 좋은거 같아요 ㅠㅠㅠ   군대에서 데드리프트하다가 쾅쾅 거리는거 조심하려고..  힘주면서 놓다가.. 허리 다쳤는데   많이 아팠는데 나아졌어요 ㅍ,2년 전
207,  @user-bh5cv7ly4k,개학하고 삐딱하게 앉아서 공부하는 시간 늘어나서 허리가 너무 아파졌는데 이거 하니까 훨씬 좋아졌어요 앞으로도 꾸준히 해야겠어요ㅠㅠ,2년 전
208,  @user-vy9po6qn6b,자세가 안 좋아서 허리가 많이 아팠는데 마지막 스트레칭 하고 시원하네요!!! 땀도 나요영상 감사합니다!!,3년 전
209,  @robinahn6775,산후풍으로 고생하고 있는 육아맘인데요.. 허리가 자주 아파서 한의원에 침맞으러 다니다가 매번 가기도 어려워서 오늘 첨으로 따라해보는데요. 효과가 있는거 같아요! 마음도 편안해지니 좋습니다~~,9개월 전
210,  @user-sc9rt3zp9x,잘 따라했어요 세심하게 잘가르처주셔 진심 감사합니다 ,2년 전
211,  @sunmilee1931,고등학교 학생인데요ㅠㅠ 척추측만증이 심해져서 고생하고 있어요ㅠㅠ 이거 스트레칭 꼭 해야겠어요ㅠㅠ 올려주셔서ㅠ감사합니다!!!!,3년 전
212,  @user-lf6jf1lm9d,매일 스트레칭하고있어요 감사해요^^ 저는 디스크2기인데 치료도받고 땅끄부부님 스트레칭도 매일하고 많이 조아져서 요새는 앉아서 일도 조금씩 하고있습니다.감사합니다^^ 완치될때까지 아니 완치되서도 계속 할게요 ^^,1년 전
213,  @shanemars7195,정말 도움이 많이 됩니다!!,2년 전
214,  @user-lf7db4cf3r,편하면서도 허리가 좋아지는 최고의 운동이예요!,1년 전
215,  @user-jh3zz3tn2d,와진짜 허리가 너무 아파서 척추 뽑아버리고 싶었는데 이 스트레칭하고 광명찾았어요 감사합니다 감사합니다   ㅠㅠㅠㅠㅠㅠ,2년 전
216,  @user-oq8ys6pg4v,허리 아프다는 말을 달고 사는데 이 영상도 꾸준히 하러 올게요,2년 전
217,  @user-wt3ff8vz1i,제가 후기는 진짜 잘 안남기는편인데 효과 짱이여서 함써봐요ㅎㅎ공부하다 허리가 아파 영상 본 평범한 초딩입니다. 요즘 허리통증 땜에 힘들었는데 덕분에 잘 나았어요ㅎㅎ 구독하고가요글구 오프닝 넘 귀여우신거아닌가욬ㅋㅋㅋ?♡항상 좋은 영상 만들어주셔서 감사합니다️,3년 전
218,  @taewanchung5352,많은 도움이 되네요 감사드립니다 ~^,1년 전
219,  @yyy_kr4530,영상을 이제야보다니 ㅠㅠ너무너무너무 허리에 도움이되는 영상이였습니다!!!!감사합니다 ㅎㅎㅎ새해 복 많이받으세요 ️️️️️‍️‍,10개월 전
220,  @user-nf1gm3qu2m,그림을 자주 그리는 중학생입니다. 항상 마감을 한 후나 평소엔 침대에 일자로 누우면 허리가 아파왔는데 이 스트레칭을 한 후 허리통증이 사라졌습니다. 좋은 스트레칭 알려주셔서 감사합니다,2년 전
221,  @jungeun7411,오드리님 넘 귀여워요~♡허리 스트레칭 운동 열심히해서 이 지겨운 허리병 고쳐볼게요~영상감사합니다~,9개월 전
222,  @user-jv7zp3ln9l,"멋진 부부, 멋진 운동정보 감사합니다^^",2년 전
223,  @matsuraruro,허리디스크 때문에 이영상보구 꾸준히 스트레칭 열심히하고있는1인입니다. 좋은영상감사합니다~!,3년 전
224,  @user-kh7is2bn1u,허리 디스크 땜에 요즘 이 영상 보고 열심히 따라하고 많이 편안해 졌습니다~^^ 감사해요!혹시 허리 안 좋을 때 올려주신 다른 운동들 따라해도 될지... 걷기 중에 허리 굽히는 동작들이 좀 있어서...괜찮으면 어떤 운동이 좋을지 추천 부탁드릴께요~,2년 전(수정됨)
225,  @user-tj3ki8lj5u,와ㅠㅠㅠ허리 너무 아파서 이거 따라했는데 진짜 통증이 확줄었어요ㅠㅠㅠ감사합니다ㅠㅠㅠ자주 와서 할게요ㅠㅠㅠ,1년 전(수정됨)
226,  @user-hj3du3id5z,필라테스 후 팔뚝-상체-11자복근-플랭크30일-스쿼트30일-하체스트레칭-허리스트레칭출석 시작합니다!9/24 +칼소폭1or29/25 +칼소폭1or29/26 +칼소폭1or29/30 10/1상체까지만10/410/710/10 무릎부상으로 복근까지만10/11 무릎부상으로 복근까지만10/14 무릎부상으로 복근까지만10/15 무릎부상으로 복근까지만,3년 전(수정됨)
227,  @user-xw5on8wp2s,허리 아파서 오늘부터 열심히 해보려고요 좋은 영상 감사해요️,1년 전
228,  @user-wr4hx3lw8f,아침에 일어나서 날하스랑 같이 이거도 같이 했는데 신기하게 허리가 안아프고 편안하네요~~항상 허리가 아픈상태였는데.. 추천해주시고 정말 정말 감사해요 ㅠㅠㅠ어렵지도 않고 매일 매일해야겟어요....진짜 땅끄부부님덕에 매일매일 하고싶은 운동이 계속 늘어나네요ㅋ,2년 전
229,  @berlykim9748,헉 안그래도 요즘 머리 감고 허리펼때마다이상하게 허리가 뻐근했는데정말 안성맞춤 동영상이네요^^이번에도 열심히 따라해볼께요~!!땅끄부부는 사랑♡♡,4년 전
230,  @user-um3lu6sw8x,"제가 정말 좋아하는 스트레칭이에요 ️이 영상으로 땅끄부부 입덕 했지요..저는 예전에 배스킨라빈스 알바를 했었는데 그때 아이스크림을 푸면서 요령없이 늘 허리 힘으로 했었고 (벽면에 다리를 기대어 체중을 분산 시켜야 함) 두달만에 허리가 아작나서 그만 두고 물리치료를 한달간 받은 적이 있습니다이후부터 조금만 오래 서있으면 허리 통증이 오곤 하는데요. 병원에선 딱히 문제가 없다고 하지만 허리 통증이 있을 땐 잠을 잘 못 이루기도 하고 종일 아프기도 하고 어쩔때는 일어나고 앉기도 힘들 정도로 허리가 아파오기도 합니다.정말 한동안 너무 아팠을 때가 있었는데 그때 이 스트레칭을 발견하였고 밑져야 본전이란 생각으로 해봤는데 한 번만에 통증이 줄어드는 경험을 했지요...(....운동 부족에 스트레칭 부족 그리고 평소 자세도 안 좋음 허리가 종종 아픔... 정말 스트레칭 한 번에도 효과 얻을 수 있다니 놀라웠어요. 이후로 몇번씩 하고 병원가서 도수치료도 받고나니까 허리가 너무 좋아졌어요.그 이후로 운동을 시작하여 한동안은 허리가 아프지 않아 영상을 보지 않았었는데 오늘 웨이트를 하며 자세가 잘못됐었는지 무리를 좀 했는지 허리가 아파서 영상 보며 스트레칭 했습니다 ️ 누워도 앉아도 서도 통증이 지속됐었는데 많이 완화되었어요.진짜 넘넘 좋아요,,, 맨날 주변에서 땅끄부부 땅끄부부 이러는거 그냥 넘겼는데 그 날 허리 스트레칭 해보고 난 후로 호감도 급 상승했어요 ㅋㅋㅋ 다른 스트레칭도 너무 좋은 거 많고요. 정말 너무너무 감사해요",2년 전(수정됨)
231,  @user-zx3qi1yo5j,연습해볼게요! 감사합니다. 다들효과가 있으시니 기대가 됩니당! 직장생활하다보니 허리가 ㅠ,2년 전
232,  @user-wh6ss4os2x,굉장히 늦긴했지만 감사인사는 드려야할거같아서요 ㅎㅎ 이 영상 엄청 도움됩니다 허리가 굉장히 편해졌어요,3년 전
233,  @user-gc6oy4we4m,오 우연히 보고 따라햇는데 난이도도 안 어렵고 좋네요ㅜㅜ열심히 따라할게요,2년 전
234,  @user-le8gd1fg5w,댄스하는 사람인데 허리가 많이 안좋아져서 춤을 못추고 있었거든요 !!  근데 이 스트레징 하고 다음날에 너무 많이 괜찮아졌어요 ! 이제부터 꾸준히 하려구용 !,9개월 전
235,  @sunha153,와... 처음에 허리 아플 때마다 다리를 눕혀서 허리를 뒤틀리게 하는? 그런 스트레칭만 했거든요.. 그래도 너무 아파서 찾다가 이 영상을 접해서 따라하는데 따라하는 도중에 막 뚜두둑 거리거나 시원한 감이 별로 없어서 아 다른 거 봐야되나 했는데 영상을 다 따라하고 나니까 신기하게 통증이 줄어들었어요... 진짜 감사합니다...ㅠㅠㅠㅠㅠㅠㅠㅠ,3년 전
236,  @user-xw9en1hf1m,"매번 보면서 잘따라하고 있어요 고맙습니다:) 이 동작들이 일자허리에도 좋은지 알고싶어요~ 좋다면 특히 저 중에 어떤자세가 일자허리에 가장 좋은지도요ㅎ3년동안 허리가 두번 나갔네요ㅜ 의사샘께서 일자허리라고 얘기하시던데, 땅끄부부 스트레칭 영상 중 일자허리에 좋거나, 허리 튼튼하게 해주는 영상 있으면 추천 부탁해요^^(당연히 이 영상도겠죠?ㅎ)",8개월 전(수정됨)
237,  @user-iz3xf7tu5c,"8/319/1, 2, 3, 4, 5, 67(엘보우 홀딩 복근 힘으로 들어 올리는 거 기분 좋음)8, 9 10<11 쉬는 날>운동 파트너가 아파서 내일 까지 쉼. 월요일 시작15(한동안 몸 아파서 죽는줄 알았음 다시 시작!!!!)16, 1719 드디어 기력 좀 찾았지만...마법소녀로 변신할 날이 얼마 안남음.....20",2년 전(수정됨)
238,  @user-qk8jk5vk7m,직장에서 계속 앉아있으니 허리가 너무 아프더라구요ㅠㅠㅠ땅끄부부 믿고 매일 도전하겠습니다!파이팅,2년 전
239,  @user-jy3qd6yv5o,땅크부부님이 추천하신 허리스트레칭 오늘부터 운동후에 시작합니다 허리도 좋아지고 건강도 좋아지는 1석2조 운동 화이팅!!!!!,2년 전
240,  @user-gw4tl6em6s,"정말 감사합니다. 최근에 허리가 급격히 안좋아져서 허리를 굽히는 건 물론 옷을 입거나 양말을 신을 때, 떨어져있는 물건을 주울 때, 재채기할때 등 많은 어려움을 겪었는데요 영상을 보고 처음 따라하게 되었는데 몸의 움직임이 비교적 자연스러워졌습니다.",2년 전
