,아이디,댓글 내용,댓글 시간
338,  @user-wn2vo9kz6j,꼬리뼈쪽부터 허리까지 찌릿찌릿 아팠는데 대충 따라했는데 좀 나아졌어요 신기..낼부터 제대로 해보려고요!,2년 전
339,  @user-hs8rl1ip8e,"요즘 하루에 허리 아프다고 느끼는 횟수가 잦아져서 허리 스트레칭을 검색했더니 뜨는 영상이 많아서 뭘 봐야하지 하다가, 자주 들어본 익숙한 이름의 채널에 들어왔습니다 오늘 처음 해 보지만 왠지 벌써 허리 통증을 책임지고 쎄굿바 시켜주실 것만 같은 기분,,, 안 그래도 방학 길어져서 남는 게 시간이니 매일 잊지 않고 해 보겠습니다! 감사해요!!",2년 전
340,  @user-gf9px6zw6s,꾸준히 스트레칭 하기12.1412.1512.1612.1712.1812.1912.2012.2112.2212.23—————01.09,2년 전(수정됨)
341,  @user-nl1my4db6c,마지막 동작 너무 좋다.... 너무 좋아,2년 전
342,  @user-mj4vn8ll6j,어릴때 운동하다가 허리를 심하게 다쳤는데 꼭 나아졌으면 좋겠어요,2년 전
343,  @gyungheekim7656,허리 아픈 친구를 위해서 찾고 친구 알려주면서 같이 해 봤어요.배경음악도 명상음악같이.. 자기 전에 무리 없이 해도 좋겠다 싶어요.요즘 약간 불면증 비슷하게 있어서요.,2년 전
344,  @user-ml6st3wi6p,리클라인 트위스트가 참 좋은 동작같습니다허리골반쪽이 왼쪽이 좀 뒤틀린거 같았는데이부분하고나면 정상으로 돌아온 느낌이고시원하네요,2년 전
345,  @user-ct4pl7xn2v,와 얼마전부터 허리가 시큰해서땅끄쀼님 영상있어서 봤는데ㅠㅠ와 아침에 하자마자 시큰한게 살짝 부드러워진 느낌이 바로나요! 틈틈이 따라하겠습돠♡♡♡감사합니다ㅠ,1년 전
346,  @user-fj3ws8bq8g,따라하기도 쉽네요~ㅎㅎ감사합니다~ㅎㅎ,2년 전
347,  @user-jt4jt4ds6b,허리가 뻐근하면 무조건 이 스트레칭 하러 옵니다 최고,2년 전
348,  @user-oz7xb9ee4t,허리 아플때마다 할게요!화이팅,2년 전
349,  @user-rh8hw5vf2r,좋은영상 올려주셔서 감사해요ㅎ,4년 전
350,  @user-zr3yb3vl5m,와 뭐야 막 자극적인 느낌은 없었는데 하고 나니까 어느새 시원해짐...신기,2년 전
351,  @hyun1668,새해 첫날부터 허리통증이 넘 심해 응급처치?로 파스 몇장을 붙이고 땅끄부부의 영상을 찾아보고 열심히 따라해보련니다.감사합니다~땅끄부부님~새해 복 많이 받으소서~^^,11개월 전
352,  @user-gm1lk3dv1q,와 이거 뭐죠....대박 이틀동안 허리 좀 무리했었는데요. 처음엔 골반만 아파서 다리스트레칭 좀 하고 잤는데 자고 일어났더니 골반에서 허리로 도져서 허리스트레칭 찾았는데 다행히 땅끄부부님꺼 있어서 했는데요ㅋㅋ 이거 한 번밖에 안 하고 잤는데도 다음 날 통증도 많이 없어지고 ㅋㅋ 너무 행복해요 ㅠㅠㅠ 앉아만 있는것도 서있는 것도 누워있는 것도 힘들었는데 지금은 너무 편안해졌어요 ㅠㅠ 이게 무슨일이야 ㅠㅠ 행복합니다 ㅎㅎ,2년 전
353,  @hong7e7s,오늘도 열심히 스트레칭 하고갑니다감사합니다,1년 전
354,  @jaeyeonkim7798,너무 시원하네요,2년 전
355,  @marieim6901,헐 ㅠ 허리디스크 주사시술 받고 안그래도 운동 찾고 있었는데 ㅠ 감사합니다! 매일 따라할게요!,4년 전
356,  @user-oj4rx8tp4f,쉽고 간단한 동작 감사해요. 작년에 허리 삐끗해서 한동안 못움직여 119에 실려갔는데.. 코어운동해야지 해놓고서 안했네요..이젠 땅끄와 오드리님 매일 짧게라도 운동해야겠어요. 감사해요,2년 전
357,  @ralira8764,척추측만증이 정말 많이 고통이에요ㅠㅠ 미적으로도 전혀 좋지않고 척추 건강상으로도 많이 안좋아요. 허리랑 목 아프면 다른 일에 집중도 안되고 많이 힘들더라구요. 알려주신 운동 참고해서 앞으로 운동 열심히하겠습니다! 감사합니다!,1년 전
358,  @user-ih1mv7ni9w,잠깐 따라하고 이렇게 통증이 반이상 줄다니  분명 10분전에 요가매트 펴는것도 힘들었는데 영상보고 따라하고 앉아보니 통증이 거의 없어요 오늘부터 저도 챌린지 하렵니다9.259.269.279.289.299.3010.0110.0210.0310.0410.05,3년 전(수정됨)
359,  @user-km6pq9iz6n,오늘 아침에 일어났더니 허리가 넘 아파서이 스트레칭 해봤는데 9분만에 허리가 안아파졌어요...ㅠㅠㅜㅠㅠㅠㅠ  꾸준히 해야겠네요,10개월 전
360,  @xxxxxxxx7330,어제 준비운동도 안하고 강도높은 운동을 해서 그런지 허리근육이 너무 아파서 해봤는데 효과 있는것 같아요 감사합니다,2년 전
361,  @user-dx2gn9cg2u,요즘 허리아팠는데 감사합니다!,4년 전
362,  @user-zg1ml5iq3k,허리가  안좋아서  오늘부터  열심히 해야겠어요~~감사합니다~~,2년 전
363,  @yeijirhee1867,어우 시원해요... 감사합니다 자주 해줘야겠네요,2년 전
364,  @user-qc8eb7wk5i,허리가 운동할때나 평소에안좋았는데 이거하니까 가뿜하네요!,1년 전
365,  @jiyoncebusan1887,"땅끄선생님 성격 진짜 좋아보이시고, 오드리쌤 너무 귀여워요! 어떻게 이렇게 해맑을수 있나요 !! ㅎㅎ 시원해요^^",2년 전
366,  @user-ch6mu5hz5r,허리통증때문에 해봤는데 좋은영상감사해요^^,1년 전
367,  @choh.6859,이 스트레칭을 한 장소가 잘못된거였어요...!! 첨에 침대에서만 하니까 효과가 별로 없었는데 바닥에서 하니까 바로 나아졌어요ㅠㅠ 땅끄부부님 정말 감사합니다 어디 계시는지 모르니까 동서남북으로 절하겠습니다,3년 전
368,  @alimohamed1467,2/11 시작발레할때 허리 힘쓰는 동작들이 너무 아파서 시작하게 됐다 화이팅!,2년 전
369,  @rian4074,하고나니까 시원해요~ 감사합니다~^^ 플랭크 영상도 찾아봐야겠어요~~,1년 전
370,  @0heeK,모닝 스트레칭 완료! 땡큐땅끄,2년 전
371,  @suekim8038,"땡끄부부 감사해여~ 저희부부 구호랑 같아 감사가 두배네여. 저희부부도 늘 ""감사합니다!!!""  저녁때면 땡크님 유투브로 남편이랑 같이 스트레칭해여. 릴릭스한 저녁되어 참말 감사해여~",2년 전
372,  @user-oo4wr8uo6v,와..ㄹㅇ 완전시원해요 최고최고,7개월 전
373,  @skykim4785,진짜 허리가 너무아파서 참기힘들때마다 한번씩하는데 효과가 느껴져요 ...ㄷ,3년 전
374,  @osmanthus44,늘 책상에 앉아있다보니 허리가 너무 아파서 파스붙이고 지냈는데 문득 땅끄부부님 생각나서 유튭 찾아보니까 허리 스트레칭이 있더라구요 그래서 두번 반복해서 했더니 진짜 거짓말처럼 안아파요 ㅠㅜ 다음에는 허리 근력키우는 영상 하나 만들어주세요ㅠ,2년 전
375,  @user-qc5ox4lp7y,자려고 누웠다가 허리가 너무 뻐근하고 불편해서 한밤중에 따라했어요 너무 시원해요 감사합니다. 저는 다시 자러 갑니다. ㅎㅎ,2년 전
376,  @user-tz3qx3mt6e,오늘은 허리가 너무 아파서 여기로 출첵입니다 시원하네요!,1년 전
377,  @subinson9995,땅끄부부님 저희 학교에서 이 영상을 3교시 스포츠클럽 시간에 넣어주셨어요 완전 행복해요 :),2년 전
378,  @pegion8718,"진짜 신기한게 허리아파서 골골대서 아빠다리 할때마다 아팠는데, 이거 한번 하고 나니 통증이 싹 사라짐.. 와우",2년 전
379,  @snow7015,허리가너무아파서 양말도못신고 하루종일누워만잇고 물리치료만받엇엇는데 이거스트레칭하니깐 조금씩나아지는거같아요 하고나면허리가너무시원합니다 ...ㅎㅎ 감사합니다 ,3년 전
380,  @user-fu8cv7cl5x,야구땜에 고생한내허리 ㅠㅠ 어린나이에 허리가넘아파서 이거보면서하는데 점점좋아지고있네요!,2년 전
381,  @user-jb4qh8rm2c,속는셈치고 따라해봤는데... 와 딱 한번 따라했는데도 효과가 이써요!!!!!! 스스로도 놀라울지경ㅜㅜ 앞으로 자주 해야게써요ㅜㅜ 그리구 여러분 의자는 비싼거(좋은거) 쓰셔야합니다ㅠㅠ,2년 전
382,  @user-rh6cp9ff9j,"땅끄부부님~ 허리 힐링되었어요,오드리님 마지막자세 편하고 좋았어요^^",2년 전
383,  @user-yv9nf2yq9p,추천해주셔서 금방 끝냈습니다^%^  안마기하다 결린 어깨에 좋은 운동찾아보러갑니다ㅋ,1년 전
384,  @samh4395,2회 반복으로 아프던 허리가 바로 났네요 너무 신기해요,3년 전
385,  @user-cd5qe9zn7d,"안녕하세요 땅끄부부님! 작년에 허리가 너무 안 좋아져서 신경외과에서 진료를 받았었어요. 식당에서 양반다리를 하고 앉아서 식사를 마치고 일어나면 마치 네발 짐승이 갑자기 직립보행을 하게 된 것처럼 허리가 저릿저릿 하더라구요,, 원인은 잘못된 자세와 운동부족이었고, 의사선생님은 하루에 30분 이상씩 걷거나 철봉매달리기를 하라고 하셨어요. 하지만 무더운 여름날에 일 끝나고 30분 이상 꾸준히 걷기가 생각보다 힘들더라구요ㅠㅠ 그래서 유튜브에서 여러 운동영상을 찾아보다가 영상을 보고서도 비교적 정확하게 동작을 따라할 수 있고, 후기도 좋은 땅끄부부님 허리 좋아지는 스트레칭을 했어요!  30분 걷고 철봉 매달려야 좋아진다는 허리가 이 짧은 영상 따라한다고 나아질까 반신반의하면서 시작했는데 진짜 일주일 따라하니까 통증이나 결리는 듯한 느낌이 완화되는 것을 느꼈어요. 차츰 나아지니까 처음만큼 열심히 하지는 않았지만 일주일에 세 번 이상은 꾸준히 하니까 엄청 좋아졌어요ㅠㅠ 어렵지 않은 동작에 심지어 10분도 안 되는 길이... 진짜 짱이에요ㅠㅠ저는 20대 중반인데 제 주위에도 허리가 안 좋다고 하는 친구들이 많아요. 아마 점점 운동량이 적어지는 세태 때문이겠죠.. 그런 친구들한테 항상 추천하고 있어요! 저도 다시 좀 안 좋아지는 것 같으면 금방 영상따라 운동하구요 ㅎㅎ 그럼 또 바로 나아져요! 정말 감사합니다. 전기치료, 도수치료 받으러 갈 여유 없으신 분들, 꾸준히 걷기운동하기 어려우신 분들, 그냥 허리가 안 좋으신 분들 강추합니다!",3년 전
386,  @suminjeong1932,오 되게 좋네여 무거운 거 드는 일이 좀 있어서 허리가 통증이 약간 있었는데 몇번 해보니 효과굳,2년 전
387,  @user-sv7by6us8p,와 진짜 신기해요허리 통증이 있어서 스트레칭 찾아보던 도중 했는데 진짜 효과 좋네요별로 안 힘들어 보여서 이게 효과가 있어? 했는데 하고 나니 통증이 줄었네요어렵지 않으니 누구나 잠자기 하기 전에 좋겠어요효과 대박이네요,2년 전
388,  @user-gs3db7xo5q,저 허리디스크데  땅끄부부님이 하는운동 하니깐  호리가 시원하고  아프지않아요 정말로  감사합니다  ♡♡♡,2년 전
389,  @user-si1on3hd1m,와우~~~!! 20년 동안 허리통증을 달고 살았는데 이 동작들 넘흐~~ 좋아요. 사랑할꺼에요~!,1년 전
390,  @user-yf1yj9id6j,"3년간의 공부로 허리가 안 좋았습니다. 진짜 10분만 서 있어도 허리가 너무 아프고 나중에는 골반뼈까지 이상하게 시리고 아프더라고요 ㅠㅠ 버스에서 서서 갈 때는 진짜 죽을 맛이었습니다 ㅠㅠ 근데 영상 보고 1, 2주 정도 따라 했는데 이제는 한 1시간 정도 서 있어야 아파오더라고요!!! 효과를 보는 게 신기합니다!!! ㅠㅠㅠ 너무 감사해요 ㅠㅠ 허리가 아파서 여행할 때도 참으면서 여행 다녔는데 이제는 편히 다닐 것 같아요~~~",2년 전
391,  @user-vo7bc7lm8x,감사합니다 감사합니다 허리가 너무 아파서 운동할때도 아팠눈데 이거 따라하고 통증이 많이 가쎴어요 ㅠㅠ 신기하기도 합니다 감사합니다,3년 전
392,  @mees5293,복근운동하면서 허리에 무리가 많이 갔는지 몇주내내 파스를 달고 살았어요ㅠ 물리치료를 받을까 하다가. 이게 효과가 있을까 의심하면서 스트레칭 해봤는데 오오... 다음날 되니까 허리통증이 좀 사라졌어요....!! 매일 운동 전에 꼭 해야겠어요,2년 전
393,  @user-tw6jy8nh8k,오늘 하루종일 허리아파서 유튜브에 허리통증 스트레칭쳤는데 땅끄부부영상있길래 했는데 스트레칭 끝날때쯤 부터 리얼 통증 없어져서 싱기..감사합ㄴ다,2년 전
394,  @ohell9767,"블랙디스크증상때문에 2년전에 응급실 한번 실려갔다왔구요. 회복한 다음에도 장기간 앉아서 하는 업무와 안좋은 자세때문에 주기적으로 통증이 와서 심할때는 진통제도 먹었는데, 요 며칠 허리가 계속 아파서 오랜만에 스트레칭 따라했더니 통증이 완화되는 효과가 진짜 커요ㅠㅠ  블랙디스크 증상 있으신 분들 앉혀놓고 가르쳐 드리고 싶다ㅠㅠㅠㅠ 허리 안좋으신 분들 이 영상 꾸준히 따라하셔서 꼭 회복하시길 바랍니다!!!",1년 전
395,  @user-ul4oi7xi7i,비오는 날엔 허리가 아픈데 이걸 해주면 덜 아프네요 자주 해봐야 겠어요 오늘도 건강하세요! 호이ㅣ팅!,5개월 전
396,  @user-tt3zc8xw6p,땅끄 운동좋아하는데 저한테는 좀힘들었는데 요통환자 운동도 있어서 감동받았어요열심히 해볼게요무릎통증도있는데 무릎 근육운동도 약하게 할수있는 운동도 부탁드려요~~,2년 전
397,  @user-ik4ge6ie5p,잘려고 누웠는데 척추를따라서 통증이심해서 이영상따라했는데 지금 누웠는데 너무편해요!!,3년 전
398,  @user-qb6zs9eb1m,허리가 아파서 처음 해봤는데 시원해요ㅠ 꾸준히 해야겠어요'')9,1년 전
399,  @user-wy7wr9sb7l,와 할땐 계속 아프고 그래서 효과없구나 했는데 마지막 동작 따라하고 바로 괜찮아지네요,1년 전
400,  @500mg3,와씨 이거 뭐야 한번만 따라해도 엄청 편해졌읍니다 들숨에 재력 날숨에 건강 얻으시길,3년 전
401,  @user-uj3ip2du4i,와 저 감동 받아서 댓글 써요 ㅠㅠㅠ 허리디스크에 목디스크여서 항상 아팠다가 오늘 견딜 수가 없어서 유튜브 검색해서 봤는데 아니 하고 일어서니까 고통이 반이상 아니 3분의 2는 사라졌어요 ㅠ 대박이네요,2년 전
402,  @user-rp5no1sm9v,허리 진짜 안좋은데 꾸준히 해보려고요! 아직은 어색해서 제대로 하고 있는건지도 모르겠지만요,1년 전
403,  @user-wc7rl7tv7h,와 구독자 느는 속도가... 진짜 대박... 이젠 그냥 티비 프로그램 같아요...,4년 전
404,  @user-tu2ws2ud1m,"저는 허리디스크가 있어서 아침에 일어나서부터 오전중에는 굽히는 것도 힘이 듭니다. 다행히 오후엔 또 아무일 없는듯 괜찮아지는데 이런지도 일년이 넘어가네요.오늘부터 이 영상으로 운동을 해보려구요. 좋아지면 다시 글을 남길게요.  땅끄부부,늘 감사합니다~~~",2년 전
405,  @pptraining181,효과가 좋아요!! 감사합니다,2년 전
406,  @user-mc4ws8rz2z,허리통증으로 칼소폭 대신 요거 하러 왔어요~엄청~시원해요~친정엄마한테도 알려 드렸어요~감사합니다ㅎㅎ,2년 전
407,  @user-ih1wy5sr6g,잉 대박 오늘 무거운거 들었다놨다 하는 일 몇시간 하고나서 허리가 너무 뻐근했거든요스트레칭이라도 해보자 하고 허리 스트레칭 검색해서 젤 처음 나오는 영상 들어온 것 뿐인데 이거 한번 따라하니까 진짜 거짓말처럼 뻐근함 + 뚜둑뚜둑 하는 느낌이 싹 사라졌어요 너무 신기하네요 좋은 영상 감사합니다,2년 전
408,  @user-cp6ec6py5t,너무시원하네요 ㅠㅠ,3년 전
409,  @user-ln7cw1sf3e,우왕!!!! 항상 어떤영상나올까 기대하면서 기다립니다 오늘도 좋은영상 고맙습니당^^,4년 전
410,  @user-he5iu6ip4h,"전 40세 딸부자맘입니다.무릎연골문제로 다리 길이가 점점 틀려지며허리 디스크까지있는데요.병원에서는 수술을 하자고 했지만 일단  다이어트 하고 운동병행 해본후  수술을 해도 늦지않다 생각하여요즘  땅끄님  방송보며 열심히 운동하고있답니다.퇴근후 30분은 열심히 운동하고 있답니다,화이팅....",2년 전
411,  @user-sh2uq7ov4h,네 땅끄와 오드리 덕분에 아주 좋은 힐링하고가네요  다음도 부탁드려요,2년 전
412,  @user-jt4jt4ds6b,저 허리 아팠을때 이 스트레칭 정말 많이 도움됐어요 ㅠㅠ 시원하거나 그런느낌이 안나서 효과있는건가 싶었는데 꾸준히 하니까 통증이 사라지더라고요 개인차가 있겠지만 오히려 너무 자극적인 스트레칭보다 효과 좋다고 봐요,3년 전
413,  @peachl.9997,허리가 뽀개진것 처럼 아팠는데 이거 하니까 훨씬 나은거같아요 ㅎㅎ 시간 될때 매일 해야겠어요,3개월 전
414,  @user-sj9gt4ig4s,와진짜 해보니깐 허리가 안아파요 ㄷㄷ,2년 전
415,  @hyejinjang4412,요즘에 허리가 계속 아프고 특히 오늘 너무 심하게아파서 유튜브에 허리 동영상 찾으러 들어왔다가 마침 오늘 딱!!! 땅끄부부님 영상이 올라와있네요 요즘 허리가 계속 아파서 걱정이었는데 정말 감사합니다 매일매일 열심히 해볼게요혹시 허리에 좋은 운동이나 팁 있으면 알려주실수있나요?? 요즘 오래앉아있기도 하고 전체적인 자세가 많이 틀어져서 어떻게 다시 교정해야하나 고민이에요ㅠㅜ,4년 전
416,  @user-wr7bq6oh7e,감사합니다.허리가 좋지 않은데쉽게 따라하기 좋은 스트레칭 ,2년 전
417,  @user-cu5co6ql5v,허리 스트레칭 영상 최고네요감사합니다 허리 근육키우는 영상도올려주시면 감사 하겠습니다,1년 전
418,  @ssuk_lim5060,오랜만에 왔어요 허리협착증이 심해서  따라해 봐야겠어요감사합니다,1년 전
419,  @user-ug2ms3ze8u,허리 통증으로 윗몸일으키기를 잘못하고 있었는데 이 걸 따라한 이후로 윗몸일으키기가 되고 허리의 통증이 완화됐어요ㅜㅜ 감사합니다ㅜㅜ,2년 전
420,  @namimlee9157,"다리 저림이 심해서, 허리 시술 받고 있는데  . 허리 스트레칭도 하라그래서 따라해봤네요 . 열심히 할게요 ^^",2년 전
421,  @user-rh2um5pw8k,가끔 찾아서 운동하면 도움되고그래서 찾아보러왔는데왜 무소식이세요  ㅠㅡ다 기다리고 있어요   !  언재든지 돌아와주세요  ! 땅끄부부_운동은_너무_도움되요,4년 전(수정됨)
422,  @user-ti4cm8ue7b,오늘 아침도 땅끄부부와 함께 운동 시작합니다 제 주변사람들도 한명 한명 땅끄부부의 세계로 들어오고 있어요땅끄부부님~더더 흥하시길 바랍니다,2년 전
423,  @user-io1ij4ir6r,4일째되니까 허리통증이 확실히 줄었어요!이주정도하고있는데 이틀빼고 계속하는데병원도 안갓는데 ㅠㅠ 통증이 많이 줄엇어요!이제 퇴근할때도 거의 아프지않아요,2년 전
424,  @user-wi6ct7th7r,저 종아리 영상보고 따라하려다 허리 아프다고 댓글 남겻엇는데욥 혹시 허리영상 잇나 해서 찾아보고 방금 따라햇는데 훨씬 편한 것 같네욤 맨낳맨날 하겟슴미당 감사합니당~!,2년 전
425,  @user-xi3sv5ih1o,완벽하게 허리 아픈게 낫지는 않지만 허리 아플 때 마다 한번씩만 해주면 아픈게 완화 되네요 유튜브 더 잘 되시길 바랄게요,2년 전
426,  @nlvea536,정말 감사합니다 매일 해야겠어요!!,3년 전
427,  @thankyoububu,"안녕하세요~ 땅끄부부입니다! (오늘은 진지모드...^^;) 우리가 하는 다이어트 및 운동 그리고 일상에서도 가장 빈번하게 사용되는 신체 부위는 다름아닌 바로 '허리'라고 할 수 있습니다. 허리는 상체와 하체의 움직임을 연결, 동력을 전달해주고 우리 자세를 신체 중앙에서 밸런스있게 잡아주는 역할을 하며 그로인해 우리 몸에서 가장 중요한 부위라고도 말할 수 있습니다. 그래서 우리 몸에서 가장 중요하다고 불리우는 '코어근육(core muscle)'군을 이야기 할 때에도 허리, 척추부근을 코어머슬 중 중요한 부위로 다루며 그래서 그와 관련된 운동 동작과 스트레칭들도 많이 존재합니다. 사실 영상을 준비할 때 영상에 대한 조회수나 반응등도 무시할 수 없는 부분이기에... 그리고 여름이 다가오는 것을 감안할 때... 칼로리, 뱃살, 다리살 등 다이어트 운동 영상을 하는것이 낫지 않을까 고민을 많이 하기도 했지만! 그래도 이번에는 예전부터 '허리 스트레칭'을 꼭 올려달라고 요청을 해주셨던 분들과의 약속을 기억하며 오늘의 영상을 준비하게 되었습니다. 동영상 설명 부분에서도 적어드렸지만, 본 영상은 저강도로 은은하게 허리를 수축(긴장), 이완시키면서 허리를 힐링(통증완화) 및 강화해주는 동작들이 대부분이기 때문에 꾸준하게 해주셔야 좋은 효과를 보실 수 있으며 운동이나 스트레칭 동작들을 평소에 안하셨던 분이라면 처음 며칠간은 근육통이 찾아오는것이 자연스러운 현상입니다. 이 점 꼭 인지하시면서 허리 꼭 힐링하시고 좋은효과 보시길 바랍니다! 항상 땅끄와 오드리 응원하도록 하겠습니다^^",4년 전
428,  @joobee2899,안녕하세요 장사하느라 하루 열시간이상 서있어서 늘 허리상태가 안좋았어요특히 최근에 코로나사태로 장사가 안되어 알바없이 혼자일하다보니 허리통증이 드디어 심각해졌어요ㅜㅜ 너무 아파서 다급하게 유투브검색으로 선생님 영상 보게되었는데 한결 허리가 부드러워지네요ㅜㅜ 유익한영상 너무 감사드립니다 설명도 차분히 잘해주셔서 정말 큰 도움 되었어요 너무 감사합니다구독 좋아요 누르고 갑니다 매일 시청 할께요 감사해요,2년 전
429,  @user-ib6or2nq4t,우와 대박........ 원래 허리가 굽어있는 자세이기도 한데 요즘 방학이 점점 길어져서 침대에 자주 엎드려있고 게임하느라 컴퓨터 앞에 많이 앉아있어서 가만히 서있기만 해도 허리가 뽀개지는것같고....너무 극단적으로 아팠는데 이거 하니까 통증이 나아졌어요......대박 짱신기해,2년 전
430,  @user-xk8yx6ug2b,감사합니다 효과잇어요 무릅통증 강화 운동도 부탁합니다^^,1년 전
431,  @user-di6uy7wf7s,안녕하세요!임신초기인데 허리가 아파서 보고 따라하게됐어요ㅠㅠ 감사합니다.,1년 전
432,  @user-du4fc3wv1s,"땅끄부부님에게 정말 감사 말씀 드리고싶습니다. 저는 운동부족과 겸하여  앉은자세로 오랫동안 게임을 자주했는데, 어느날 디스크가 빠져서 시술을 받은 경험이 있어요. 항상 통증에 시달리고 운동해야지 운동해야지 생각만하고 운동은 전혀 안했었습니다. 하지만 허리아픈게 평생 가는거다보니 걱정도 되기시작하고 해서 처음엔 쉽고 편하게 할 수 있는것들을 찾아보다 땅끄부부님 영상을 접하게됐어요. 이 허리 스트레칭 영상을 보고 해볼까 해서 그냥 한번 해보고 잤는데 자고 일어나니까 세상 통증이 없어져서 정말 깜짝 놀랐습니다.. 단 한번 했음에도 이렇게나 효과를 보다니 제가 얼마나 게을렀는지를 새삼 깨닫게 되었어요. 덕분에 요즘은 이영상 저 영상 챙겨보며 열심히 운동하고있습니다! 허리통증이 없으니 새 삶은 얻은 기분도 들구 ㅎㅎ.. 땅끄부부 두분에게 정말 감사합니다 좋은 영상 만들어주셔서..",3년 전
433,  @niceyou6726,전도사왔습니다♡ㅎㅎㅎㅎㅎ진지모드 허리운동 진짜 감사합니다♡ 소개했는데 칼로리소모폭탄운동 진짜짱이래요♡♡♡♡♡끝판왕도 소개할께요 공유하러갑니다~♡♡♡,4년 전
434,  @yeong794,안녕하세요!! 땅끄 선생님들 동영상 보며 따라하고 있는 20대 초반 학생입니다. 저는 고등학생 때부터 오래 앉아있다보니 허리가 많이 안 좋습니다ㅠ 허리 왼쪽 척추 주변 신경이 지나가는 쪽이 저릿저릿해서 오래 앉아있지 못하고 비가 오기 전날에는 왼쪽 허리와 다리 통증이 심합니다. 병원에 가도 디스크가 아니라 허리 근육이 뭉쳐있다 허리 근육에 무리가 갔다 허리 근육 강화가 필요하다 등등의 진단만 받았습니다. 최근들어 이 영상을 보며 따라하고 있는데 첫번째 동작 행잉니 백풀에서 뒤로 등을 빼주면 평소 저릿저릿하던 허리 왼쪽 척추 주변 신경 지나가는 쪽이 더 센 강도로 저려옵니다. 제가 동작을 잘못한 것인지 아니면 주변 근육을 쓰면서 자극이 오는 자연스러운 현상인지 궁금합니다! 어디 물어볼 곳이 없어 댓글로 질문을 합니다. 꼭 답변 달아주시면 감사하겠습니다. 항상 좋은 영상 올려주셔서 감사합니다:),2년 전
435,  @user-kc2sd9gi7u,오 대박 위허리가 매우 뻣뻣했는데 이걸하니 약간 열오르는듯 시원하게 풀렸어요 마사지받은거같아요,2년 전
436,  @user-xj8rq2lz7r,도움이 되네용감사해요,3년 전
